text,label
Book addCar car hire at Varna Airport through Rentalcars.com and you can amend your booking for free.,1
Do you have a question concerning ViewSonic PC V35?,1
"""""""Healing...with just listening""""... – this is the music from Sat Hari Singh and Hari Bhajan Kaur on their third album.""",0
portable new scooter electric 8 inch new scooter electric new scooter electric motor tire 36v 350w new scooter electric best quality new scooter electric 2019 new scooter electric,0
"5. Finally enjoy, and remember to share with friends!",0
"Me them, you me.",0
"As with a bull market, a bear market can affect individual sectors or the majority of a stock market.",1
Or it's gonna take you with it!,0
"they stayed deaf to all, but they didn't change anything",0
Weather forecast Brentonico this week Saturday,0
The post A study reveals the gender sensitivity of global public private partnerships for health appeared first on SUN.,1
Back /Company Information How do I find a store nearby?,1
"""11 thoughts on """"Share an email account between multiple users of your Wi-Fi network"""" MARISA on October 12, 2013 Reply ↓ thanks for all these explanations , sofwarepero not know much of me will be to help many !!!!!!""",0
5: Regencia can offer better rides with a light wind behind them).,0
Ilaria Start exchanging your home!,1
"Beverages included *... Complementing wine, beer and softdrinks",0
"Fans of good vibes and adrenaline, book your weekend and be sure to follow us for news to come very... Read more news",0
"itself is simple and comfortable with everything we needed (pots and pans, beach toys, etc.",0
And now I can't open my eyes and...,0
"The region of Huainan (between the Yangzi and Huai rivers) became a new borderland and battleground between Song and Jin from 1128 to 1141, displacing hundreds of thousands of families who had lived there for generations.[87] The Southern Song deployed several military commanders, among them Yue Fei and Han Shizhong, to resist the Jin as well as recapture territory, which proved successful at times.",1
"Standing committees considering Estimates may invite witnesses to appear including the Minister, departmental or agency officials, as well as interested individuals or groups.",1
"Research in 2006 has revealed that visitors to Niagara-on-theLake who do not currently visit the fort are interested in hands-on experiences, exhibits, guided tours and period military demonstrations.",1
"So we cunningly designed our lobby to feel like a comfy, inviting and homely living room instead of a lobby. Clever, eh?",0
- I know someone.,0
"To take these discussions forward, I circulated on 15 July a set of questions concerning the Domestic Support and Market Access pillars and encouraged you to reflect on them.",1
Loading...,0
"What he's saying is, you're not getting one solitary, single child.",0
"The key elements of public mask of Bush or persona, correspond to the community-service oriented vaticanum Dink Stover, an early addition to the thousand points of light.",1
"As ya think about it, starts with an itch.",0
"What the hell are you doin', jerk?",0
The Conference therefore invites the institutions to adapt the relevant rules accordingly.,1
"The symptoms of a Listeria monocytogenes infection are similar to those of other foodborne illnesses showing signs of fever and diarrhoea, however they can vary depending on the person.",1
"· managers were to pursue good performance at all costs, because their stock options and other performance-related compensation made their own fortunes tied to that of shareholders and the corporation.",1
I don't think he'll get it.,0
The advertisers and/or other content providers that may appear on this website may also use cookies that are not sent by the Kerastase website.,1
"Their wild relatives have several characteristics, such as a relative lack of aggression, a manageable size, early sexual maturity, a social nature, and high reproduction rates, which made them particularly suitable for domestication.",1
"So the celestial motions respond to mathematical laws and determine evident macroscopic effects on the planet as the seasons or the rhythms of nature, as well as all the microscopic biological rhythms of its various kingdoms and creatures.",1
- Where the fight started?,0
So you tell him what I said and let that be it.,0
"Because of its low toxicity and the mildness of its basic properties, slaked lime is widely used in the food industry to:",1
How to draw the Mammoth to the child with a pencil step by step,1
Clerprem received the award in the category of suppliers with less than 500 employees for its excellence in product innovation resulting in an ultra-lightweight seat to improve environmental performance and for its societal engagement to meet the high standards of its customers.,1
"Now yes, it's a little bit out of town, but it's a start.",0
You will have to call fclose() afterwards.,1
"Manufacturers from time to time issue new versions of the ASUS G46VW ATKACPI Driver 1.0.0023 for Windows 8 64-bit software, repairing the errors they find that may cause problems with the ASUS devices.",1
"But the two commodities whose identity of quality is thus assumed, do not play the same part.",1
- Any news from Italy?,0
A must have for any rooted phone!,0
Preface and tips on how to use the manual Xantrex Technology RC7 - At the beginning of each manual we should find clues about how to use the guidelines.,1
"I had to work very hard, very, very hard with them.",0
"If you let your Security Control Pass expire, you will need to complete a new RAIC application form.",1
It's nice that there are no time limits and not be distracted by the accumulation of points.,1
But He's still the same lovely Lord Jesus.,0
Device is not detected,1
Support children’s development through digital collaboration and interaction with their parents.,1
"For example, grinding can be used to thin the plate by several hundred μm.",1
Or you can ask us to send you a Proforma Invoice for your order.,1
"Captains - Airbus A320F Headquartered in Glattbrugg Zurich, Germania Flug AG was founded in August 2014 with the objective of establishing a high-quality product tailored to meet the needs and high standards of the Swiss market.",1
- You're not wearing hospital clothes.,0
Or maybe the perfect start to your night!!,0
Protecting athletes’ health and preventing injuries and illnesses in sport are top priorities for the IOC and its Medical and Scientific Commission.,1
:: Health and habit-forming drugs in young people,0
Ivy rose tries to pawn a famous daredevil's helmet on xxxpawn!,0
There are many applications on the market that successfully open files with the .IRX extension.,1
Spain received an international judicial cooperation request from Italy after the country conducted several investigations which confirmed the falsification of oil products from Andalusia.,1
This is down to the fact that these results are drawn from data issued from half-yearly execution reports which the managers of operations funded by the INTERREG IIIC programme have submitted to the European Commission.,1
I told you but you wouldn't listen to me!,0
« It’s very different from Madrid » she says with a cute smile!,0
In EPC implementation guides these elements are differentiated by yellow background for SEPA Core and white background for SEPA AOS.,1
"Well, you picked an awful time",1
"Each containment chamber is specifically designed around the entity's anomalous effects, to keep it from ruining your day!",1
"Because she'll do anything it asks, no questions.",0
Low season rest of the year.,0
"""Elodie Marais, born and raised on Réunion Island, is Vincent Zerbone's partner. She tells me why sharks aren't her friends: """"When I was young, there were only two other bodyboarder girls with me on the island, it was terrific.""",1
"The centralised data enable permanent operational monitoring of installations, provide a better understanding of the network, and allow its operation to be optimised.",1
Let's go home!,0
"Requests the Special Rapporteur on the situation of human rights in Myanmar to monitor the implementation of this resolution, including by seeking an urgent visit to Myanmar, and to report to the resumed sixth session of the Human Rights Council, and in this respect urges the Government of Myanmar to cooperate with the Special Rapporteur;",1
"Where the fuck are you, Phillip?",0
"By the way, something that may possibly cheer you up:",0
Luggage Storage Charles MGH Station - 7 days a week - from $1/hour,0
Flight stats for Falcarragh - did you know?,0
"It can be fast, simple, free and in addition to look at.",1
"In addition to police data, we also look at some data from provincial criminal courts as collected by the Adult Criminal Court Survey (ACCS).",1
I bet Smitty's got 15 bucks on him.,0
(e) The payer shall have the option of instructing his or her payment service provider to block any direct debits to the payer's account or to block any direct debits coming from one or more specified payees or to authorise direct debits only coming from one or more specified payees.,1
- You're destroying my education.,0
Phen375 Winnipeg Canada: Reviews And Where to Buy?,0
"One example is Near Field Communication (NFC) technology, which is a form of contactless communication between devices like smartphones or tablets.",1
"– Don’t miss the nature walks of Lulu, the nature guide of the station.",0
It took us a bit longer to get this one released but it was definitely worth the wait!!,0
"To date, there is no histological consensus marker predictive of recurrence.",1
- Where'd you get that?,0
"If you activate IP address anonymization on this website, your IP address will be processed in a shortened form in member states of the European Union or other signatories to the Agreement on the European Economic Area.",1
And then we get to the same place without all the risk.,0
-Did Psych come down for that boy?,0
This 8-person room with air conditioning in Manila offers a great stay.,1
I'm really not such a bad fella.,0
I have nothing to give you ... what my eyes see .,0
We may use your personalinformation to send you promotional information about third parties which we think youmay find interesting if you tell us that you wish this to happen.,1
"But then I talked to Carol and she told me more about your situation, and I realized, I might've... you know, just... misjudged you, so-so I'm sorry.",0
"A number of years ago, the World Health Organization (WHO) issued guidelines recommending a reduction in particulate matter (PM10) pollution from 70 to 20 micrograms per cubic meter.",1
"Avoid areas at risk from secondary processes, such as landslides, rockfall and soil liquefaction.",1
14.1 These Terms of Contract with Users are regulated by the law of the Italian Republic.,1
- She's in jail?,0
A short form is an extract of information from the original birth registration.,1
Don't you think I'm just a little over qualified for this ?,0
The CGC issued a memorandum to the trade in July 1999 advising them about the complaints regarding non-compliance with these Regulations and seeking comments as to whether or not the regulations should be retained or repealed.,1
- Yeah. There's a conference here in Grandview.,0
Choose your favorite Personal development activity below among 4 suggestions within 200 miles of CBD Singapore .,1
"With a thousand Juliáns working together, Mexico would be a very different country.",1
The resurgence of suicide bombings since the beginning of the second Intifada in September 2000 - which have targeted Israeli civilians as well as military personnel causing the death of more than 900 people and thousands of wounded - is a matter of the highest security concern for Israel.,1
I--I turned my head; I couldn't stand it. So the...?... walked out of the room.,0
Who's doing the loudest bitching?,0
— Ah... yes... (It takes him far too long to find the product page on their site.) There.,0
"We were discussing literature and I told her about my favourite novel, Cien años de soledad, written by Gabriel Garcia Marquez.",1
So these are helicopters with four rotors,0
Grants Resources Find out which Google mapping tools will help you change the world,1
The house is within the olive trees.,1
"Best 25+ Rose royce car ideas on Pinterest | Royce, Rose royce and Gold bentley",0
What role do senses play in bonding?,1
Some 400 purebred breeds make up the dog population: each one is a genetic isolate with unique characteristics resulting from persistent selection for desired attributes or from genetic changes and inbreeding.,1
"Sunday Closed Berlin Friedrichshain Vans Only car hire, tailor-made for you",0
"Yeah, now that's hot.",0
- Who is Toby?,0
"The site, all the pages of the site and the material contained therein are not intended for persons belonging to jurisdictions in which, by reason of nationality, the person, their place of residence or for another reason, access to or the consultation, availability or publication of said site, pages and material is restricted or prohibited.",1
Terrorist jihadists are thugs having thug dreams.,0
The world united to find a response to the global economic crisis.,1
The voltage system is currently being updated and is in transition from 127 to 220V.,1
The hottest sleepy family sex videos featuring real amateurs - only at Night Penetration!,0
"If you don't like it here, you can take your cut and get.",0
He wants me to come over and feel his bicep and more! Rachel: Are you kidding?!,0
Classic The softer texture of Classic offers the ultimate protection for toddlers and young children from bumps and falls.,1
Our middleware and application server experts are able to identify bottlenecks and adapt the application server configuration to get the most out of it.,1
17 A. I state that the new cemetery had 938 victims that were exhumed,1
That's all I can tell you.,0
"26 Unless authorized under this Act, it is prohibited for a person that is authorized to sell cannabis to sell it in a package or with a label",1
- I've done it on my clothes.,0
"A better future for his kids, for himself.",0
"If you have any questions, requests, or concerns with reference to your order, please use this contact form to send us a message and we will respond as soon as possible.",1
Close your eyes... .. say the magic phrase and Chiggy is in the dream world of her mirror.Die magic phrase they then pronounce the following sounds: volij-holij-dolij-zip.,0
"The method as recited in claim 7, 8 or 9, wherein moving the gate (40) includes selecting one of a multiple of apertures (44 - 44D).",1
"Members of Parliament, regulators, State representatives and members of the French Digital Council (CNNum) have been working together since June as part of the General Assembly on new digital regulations, launched by France’s Secretary of State for Digital Affairs, Mounir Mahjoubi.",1
It is my first cooking class.,1
"But, in a way different than this.",0
- I am?,0
There's gunmen.,0
"Equipment: large double bed, cozy seating area, flat screen TV, telephone, separate toilet, shower",0
That's terrible.,0
"So my mantra now is ‘we’re going to get a job, we’re going to get a job.",0
"I mean, having porn on your PC is so 2000s, I am not sure who still does that... maybe the older generation or some shit.",0
"The prior art for threaded tubular or non-tubular connections (screw-nut type, for example) proposes means for improving the fatigue strength of threaded connections subjected to axial tensile loads which can vary cyclically.",1
"Best hostel in town!Abraham Hostel Jerusalem is well-known for its friendly and welcoming atmosphere, helpful staff, and exceptional value.",1
"The vinyl coating may melt when if it comes in contact with very hot utensils, pots or pans",1
"Oh, that red head of hers is no lie.",1
- It's very nice.,0
- It's something that is one of the kind.,0
But I like it for sure.,0
"Angel, one load of guns ain't going to stop them raiding villages.",0
Daniel Haroldsen I received the package a few days ago.Thank you so very much!,1
"Finally, assess whether you work better with music or without, and plan accordingly.",1
"For the past month persons who have been out late nights have reported seeing an airship, but few believed the stories.",1
"Ben, you can look all over this house for that jacket, but I'm trying to protect my son... please don't call the police.",0
And... I'm gonna take good care of you from now on.,0
"Sweepstakes, Contests, and Promotions . If you choose to enter into one of our contests or other promotions we may disclose your information to third parties or the public in connection with the administration of such Promotion, as required by law, as otherwise permitted by the Promotion’s official rules, or otherwise in accordance with the terms of this Privacy Policy.",1
- That's okay.,0
EQ.: What is your favourite Etsy shop of the moment?,1
"Ministers responsible for the environment, social services, transportation and highway safety, and Indigenous and northern affairs, among others, have all held productive meetings.",1
Upload images and display them in an attractive way.,1
It's gonna be okay.,0
Arthur: I'm just doing my job.,0
"Maybe help each other figure out who we really are and I don't know, maybe trigger a few more memories...",0
We can reduce the costs and maximize the opportunities.,1
Keep an eye on your payments all the time and wherever you are using your mobile phone.,1
"Look, we can protect you, find you a place to stay.",1
Check the prize of our covered parking.,1
"The boats are different, and the record is harder to get.",0
“Dakhbit” is considered a Tajik toponym in an area inhabited by both Uzbek and Tajik peoples.,1
"Remote control-operated, these models have many programs to choose from and two motors for better cleaning.",1
- of famous working moms.,0
"However, a copy of the quorum data isn't stored on the witness server.",1
"It is good news that investments of this type are being made in the midst of the current situation the ceramic industry in Spain is suffering, and we would like to take this opportunity to thank you for your trust in us.",1
"As a worldwide leader in vaccines, sanofi pasteur is committed to the protection and improvement of human health throughout the world by creating superior immunological products for the prevention and treatment of infectious diseases and cancers.??Contribution of the Public Health Agency of Canada??Public Health Agency of Canada The Public Health Agency of Canada, while not a partner organization, has contributed grant funds to the CIHR for this study.",1
"This 27cm long wooden xylophone and mallets , the first two songs sound very professional.",1
"Up in the audience, way up there, have you got 59?",0
The Apostle Paul made this practice clear to the Ephesians when he asked:,1
Around the house there 'a lot (but essential yes) but twenty kilometers there is the wonderful Lucca.,0
I-it killed them all.,0
You wanna see the Yankees.,0
"The aspects of the UFO problem and the scientific objectives relating to them are, in my opinion, these:",1
The standard duration depends on your subject and the university.,1
"Hey, that fellow down there, you think maybe he's a mosquito you can shoo away?",0
There is one train station from which trains depart Spartanburg on their way to Trenton.,1
"No, no, let him -- let him finish.",0
-So I'll just be right back with your pie.,0
"Track cycling, held at the Olympic Velodrome.",1
"In Sahaja Yoga you will find meaning to all the religions of the world, to all the great incarnations who have come on this Earth.",1
"Even with the soldiers home again, the Habs won the Stanley Cup against the Bruins in 1945 – 46.",1
From the top.!,0
Here’s our pick of the best last minute flights to Tunis Carthage...,0
- How are the others?,0
You didn't make me a train wreck.,0
Men's cycling apparel: XS/S _ Primeau Vélo FAST and FREE shipping Canada wide on orders over $99 Some conditions apply.,0
"In us/where-is/Wayzata,minnesota you will find more information about Wayzata, MN, distances from neighboring towns and major cities (in kilometres and miles).",1
And then poor Cheryl and Martin.,0
He adopted his father’s name.,1
"Meanwhile, during another party (neighbors?)",0
"28 And he was with them coming in and going out at Jerusalem. 29 And he spake boldly in the name of the Lord Jesus, and disputed against the Grecians: but they went about to slay him.",1
First - the TBL file may be incorrectly linked (associated) with the application installed to support it.,1
"- Well, I like it.",0
More ads at 500 km around Lumberton View more,0
"This so particular volcanic panorama is something unic that I higly recommend you, and you don't need to be a trekking expert to enjoy (just cover yourself and no flip-flop).",0
"Uh, well, Noah had come to the island to research his book.",0
"Passbask is an international trans-border pass with which you can travel to Baiona on Euskotren and SNCF, on a single ticket within the time limit of the said ticket.",1
"According to our data, Ryanair, Vueling Airlines and Iberia are the cheapest airlines to fly this route.",1
In fact there was an assortment and even the new umbrella Barbie.,1
Read also: Romantic Breakfast: Surprise Who You Love With These Ideas,0
"""""""Our recommendations were the result of the input of manufacturers, associations and other organizations from across the country.""",1
"50ch DVR,recording 30days,with 720p 1.0mp cameras,storage space will be:",0
Then what?,0
Downtown Car rental in airports near Soubré,0
In his canvases he paints everything that he experiences around a succession of images.,1
Dominance War will not be held responsible for late or missing entries for any reason whatsoever. It is the sole responsibility of the entrants to make reasonable allowances for upload times and to plan accordingly.,1
Get a 10% discount on canyoning excursions with your HI membership card.,0
Open all year @Sehr beautiful place right on the Regnitz.. Good connection with Bamber bus stop right on the site. @ Ca.. to Bamberg 5 KM - accessible by bike very quickly..,0
The strength of Digitalis lies in its ergonomics and ability to adapt to your specific needs.,1
Who can kill whom!,0
You should take Odefsey once a day with food.,1
Duna Beach: You can hold an informal and casual reception for up to 150 guests on the beach. This area next to the swimming pool can be reserved on an exclusive basis after 6:30pm (except between 15 July and 31 August).,1
- What's the question?,0
"In the southern United States, adult Yellow Rails are commonly attracted to rice fields by the apparently suitable habitat; however, they can experience high mortality rates from harvest operations in these fields.",1
"- No, wait, wait, wait. We came out here for a reason.",0
[Man] Go ahead.,0
"Happy hour No nearby restaurants, limited menu in the lounge",0
"Considering the challenges associated with these issues—such as in raising life expectancy in poor countries, let alone of providing conditions required for critical reflection—Nussbaum describes an ambitious agenda and has yet to examine the politics of enacting it.",1
❍ Keep lid on the carafe when in use.,0
Great Britain: The Largest Model Railroad in the World,0
Rocco Forte's Verdura Resort 4 nights with breakfast & golf starting from € 579 in low season,0
"The Jd of lauryl alcohol has been determined at different rates of stirring of the bulk phase and at different sites along the intestine, in animals of different ages, in varying species, in rats with streptozotocin-induced diabetes mellitus, following abdominal irradiation, after acute and chronic exposure to ethanol and after the feeding of various diets.",1
- You okay? Yes? - Yes.,0
4 SACE Adelaide was established in 1987 and is a leader in English language training.,1
"Facades often fade when exposed to pollution, surrounding grease or various particles in the air. The Rénovation Bâtisseurs du Patrimoine Français team can clean and strip your facades using the gentle sodablasting technique.",1
"To become supreme ruler and seize the Crown of Destiny from the devious Cardinal, you’ll ally with the famous Three Musketeers, slay ferocious beasts, build your own magnificent Castle, engineer an unstoppable Airship, rally with friends to destroy enemies, and more! FEATURES: Strategy Warfare!",1
"Below is the list of CPA ID numbers for those candidates who successfully completed the CPA Common Final Examination (CPA CFE), written on September 12-14, 2018, and have agreed to have their names published.",1
"Contextual O bservation Contextual observation means observing user behaviour directly in their environment- at work, in their sitting room, in a shop- or when on the move – in public transport, in a road.",1
Which is not the cool-guy thing to do.,0
I punched a dick.,0
- He has a lot to give...,0
12 Such people we instruct and urge in the Lord Jesus Christ to work quietly and to eat their own food.,1
What Hitler had not succeeded in doing was done by moral bombing .,1
"This cooperation resulted in the Seniors Service Strategy, an annex to the Service Vision for Canadians, which will help the department to improve services to seniors across the government.",1
We do not charge any additional commissions the dates you need.,1
"The reason I didn't tell you in the first place is because I'm putting myself through school and I really, really need this job.",0
