text,label
"These processes, which are based on a circular economy concept, are likely to create a flow of added value by the development of leachate treatment and resource recovery processes that could feed several sectors qc.ca",1
"Nonetheless, it is hard to see why a State that has objected to a reservation made by a predecessor State should have to repeat the objection when the same reservation is maintained by the successor State.",1
- What were you thinking?,0
"The European Parliament has supported the main principles of the Commission proposals, notably on the capping of payments, the Greening of 30% of Direct Payments and a Rural Development policy more adapted to the diversity of local specificities.",1
But I'm sure he's going to take another shot.,0
"30.1 Paroles d'Agur, fils de Jaké. Sentences The words of Agur the son of Jakeh, even the prophecy: the man spoke brutish than any man, and have not the understanding of a man.",1
"Of course, the preceding description relates to only one possible embodiment of the invention, and other embodiments are also possible.",1
"He brought her in, And he stayed with her Until she died.",0
Just gonna top this up quickly.,0
"For this, our production must be recyclable from the very start, or otherwise of small enough ecological footprint to be accepted by the ecosystems.",1
Oh this free online Tetris game is one of the most addictive flash games ever!,0
"The downside to Sanhok is that the mad dash to find a gun at the start and take out your neighbors can often leave you feeling defenseless if you don't get lucky with a loot drop, but if you can make it past the initial purge it's an excellently designed map that feels like a condensed version of Erangel.",0
"- Yeah, just call me, okay?",0
4 Weather forecast Lerwick next week,0
"Itâ€TMll be safer and save fuel, too.",0
Service standards are a public commitment to a measurable level of performance that clients can expect under normal circumstances.,1
Don't be afraid to ask for help?Day 24:,0
"Nonetheless, there is room for improvement, which is why the Commission proposed a package of measures in April 2005 to strengthen the European Union's response capability in the field of civil protection.",1
"This example describes a practical embodiment, in three steps, of a collector-electrode assembly for a polymer electrolyte cell also illustrated very generally in FIG. 1.",1
And who is fighting for him?,0
You can find more information in our Au Pair Article.,1
"Carton of 5 reams (2,500 sheets).Available Delivered in 1-2 days Your Price $39.95",0
Listen to good music.: 75.7%,0
Just leave us alone.,1
I hear you got some kind of--,0
7:00 2 asian girls lotion on bodies squirting while fucking with doubledildo and stra AsianBig pussyDouble,0
[ Voice breaking ] And then she collapsed.,0
"Soft Cotton material,keep your puppy more cute",0
Emoticon Download and Details - beating heart,0
"12 of 35 Skiing in Cloudy or Windy Conditions (1) there is nowhere to ski when it is windy or visibility is bad and lifts often shut, (3) there are some trees for poor visibility but main lifts sometimes close, (5) Argentiere is mostly in forest where you can ski in flat-light and windy days, lifts rarely close.",0
"fore the place the local festival that is.. e va via, making recall.",0
More about this B&B in Ophemert,0
"If everything is in order, select this option the next time you open a file with the .JCSK extension.",1
"Preliminary safety testing of a veterinary biologic typically includes a mouse safety test and testing in the target animal, often during the initial proof-of-concept studies.",1
"Encourage children and teens to attend support group meetings, and include them in counselling sessions.",1
"Once the till drawer pops open, you can place the cash or check in the drawer and count out any necessary change.",1
Flights to Hopetoun,0
"The PACE had, at that time, been under pressure from European public opinion, shocked by the bombing of Grozny, which had caused several thousand deaths and which, according to television reports, was constantly ‘intensifying.’ [...]",1
We'll go to the Supreme Court on Friday.,0
EUR 50 million for the extension of the science park in Helsinki.,1
Ideal to share,0
"With this assurance of their president the committee separated, after having fixed their third meeting for the following evening.",1
"Finn, don't.",0
"With goals ranging from ending hunger to supplying everyone with electricity to protecting land and water biospheres and responding to climate change, the broadranging goals, along with the 169 targets and 228 indicators that define them, lay out an ambitious agenda for change between 2016 and 2030.",1
"This window mesh has a very high simulation performance of a real thing, and increase the authenticity of your car.",1
"You can purchase really typically countless buy Dianabol, Deca-Durobolin and Clenbuterol in below ask about as it is among the most effective.",1
Welcome to Our New Venue!,0
Congratulations for these gorgeous 25 years!!,0
"Without prejudice to the possibility to delegate specific supervisory competences and responsibilities as provided by Community legislation, the presence of a co-ordinator entrusted with specific tasks on the supplementary supervision of regulated entities in a financial conglomerate does not affect the tasks and responsibilities of the competent authorities as provided by the sectoral rules.",1
It should be noted that the ultrasonic wave is often in the form of a brief pulse comprising several alternations.,1
Abstract : The main scope of this PhD thesis is to utilize very high-resolution remote sensing LiDAR data to extract some of the tectono-geomorphic traces imprinted in the morphology from large prehistoric earthquakes.,1
"For our part we will make our effort in Lausanne, and whoever wants to come to the party is warmly invited.",1
The energy balance,0
Did you stay in B&B 't Huys van Enaeme ****? Let us know what you thought about it and help others to make the right choice!,0
When increase a picture frog in the lake press the left button of the mouse.,1
"Then the warm heart develops, with a floral bouquet where jasmine is the star.",1
"Well, we're hoping that's not gonna happen.",0
"Do not hesitate to dare the overlays: open like a long light coat, on Straight jeans or Lila pants more dressed but still comfortable, combined with Petra tank top underneath, and you’re ready to go!",1
That's never been House.,0
He's going to need something a lot bigger to get through this.,0
Dinner in the specialties restaurant (From 3-night stays),0
Physician-assisted suicide and euthanasia in Canada,1
2. The CFO should communicate to all acquisition cardholders and managers that FAA Section 32 authority must have been obtained from a budget holder for all acquisition card purchases regardless of their value.,1
The Committee inscribed Noel Kempff Mercado National Park on the World Heritage List under natural criteria (ii) and (iv).,1
Jesse... Are you okay?,0
Both of you!,0
Saleouffer is one among those infection that is capable to make your PC corrupt and unusable.,1
Want to meet our Team?,0
Sort reviews by country,0
- This is it. This is the truck.,0
Comes pre-charged,0
"I think.... I think, perhaps, we've been given nothing else but clues.",0
Celebration of the Value of Each Person – We know and appreciate each person; we listen to each other and develop and share our talents and gifts.,1
- You find asthma medicine?,0
- What if someone's there?,0
"If you're brand-new to ClearCorrect, just start at the beginning and work your way down.",0
What's the holdup?,0
Poker is Tough,0
"Yeah, there's nothing here.",0
I'm being promoted... to Uncle's laundrette.,0
But is it the wish of all?,0
The decision on which route to choose should be discussed in length with your surgeon.Â You should feel comfortable with the decision you make.,1
"My therapist says i should get out more, but...",0
"This result has been achieved, according to the invention, by adopting an operating method which implies:",1
"""These constant attempts to amend the decalogue and to adapt by alterations the moral law to the appetites developed by loose and easy living constitute the outstanding peril to our unprecedented prosperity.""""""",1
"Our highly professional La Baule property agents offer their distinguished clients a full range of La Baule property services which include not only property search and property sales, but also valuations, legal, financial, administrative and practical advice.",1
I had to pitch forward with enough angle to avoid stalling.,1
No! There's too many!,0
Stevenson left in the middle of a job and didn't pick up his pay.,0
"On February 27, the Crosstown, along with area businesses and the local BIA, hosted a “Thank You Neighbour” event as a big ‘thank you’ to the residents and businesses in the area for their patience during construction.",1
This show is sold by CelineSexy,1
I'm not wearing a cake jumper!,0
That's why you have to...,0
Find out why Glice is so different!,0
"Kylie told you that, huh?",0
"If Morris is a killer and tries to kill again, we'll be there.",0
And you know what's scary is it actually tasted kind of fine.,0
"No point hiding, mate.",0
Just follow me and we’ll take that ridiculous tree to pieces!”,0
"We pray with them,",0
What is the fastest way to get from Heathrow Terminal 5 Underground Station to Mortlake?,1
"Click on this link to get a taste of Robin et Marion, a magical play brilliantly written by Étienne Lepage and beautifully interpreted by Renaud Lacelle-Bourdon, Gabriel Lessard, Kim Despatis, and Marilyn Perreault, under the superb direction of Catherine Vidal. ... Continue reading →",1
You asked Wayne to lie for you?,1
"A device of this pie safe, floor wellprotected from moisture and frost, but at the same time and is expensive.",1
(Stop at Amalfi about 1 hour) - Lastly the visit to Vietri sul Mare undisputed capital of the artistic ceramics.,0
How does dynamically controlled lighting work?,1
- Don't be looking too much.,0
The colour looks very much like Klein blue but funny little horns the size of a little finger pop out of the canvas to come and play with the strong light above.,1
"Geneva (ots) - If they want to win, elite and amateur athletes need to make their oral health a top priority.",1
Subscribe to the comments list RSS feeds,0
"In a statement signed by 13 institutions, organizations and personalities of the Civil Society, the signatories express concern about the current political situation, which places the country according to them « totally outside the republican order...",1
The Safety Compliance Notice is a label affixed to a boat to indicate that it meets Canada's Construction Standards for Small Vessels and it may include maximum capacity and other important construction information.,1
"Read more Chinese Herbal Medicine for Panic Attacks 01/03/2018 by E.Qi.Librium Herbs If you have never had a panic attack, you cannot imagine the minutes or possibly hours of sheer terror that the person having one can experience.",1
You know you're wrong!,0
"Additionally, since it is a derivative of DHT, it is structurally unable of transforming to estrogen, so customers that might be sensitive to gynocomastia or water retention don’t truly have to stress over that issue arising.",1
"A lot better yet, they didn’t do an extreme last minute diet or pump iron at the gym.",0
"Well, I liked some of the stuff I got here, I won't lie.",0
"Sun City Girls — Sal Manilla — Listen, watch, download and discover music for free at Last.fm Previous",0
"This Provencal village, ideal for escape, will welcome you in one of its charming hotels.",1
"The No 1 generator, the fuel control unit, and the engine-driven fuel pump were then replaced.",1
"kisses his sinewy arm,",0
Chinese Fresh Nuts,0
"Another issue most people will be confronted with when exploring therapy options, is the trend to apply the term ‘codependence’, which originally implied a partner of a person dependent on alcohol or drugs, to all interdependence and to thereby discourage any truly intimate relationships.",1
"The body will feel the NEED to make that kind of physical activity, proper diet and use of Natural cosmetic products and feel the need to eat that type and the amount of food and the skin will tell us to apply that kind of cosmetic.",1
The bed is not very comfortable if you sleep two (it feels much the other person move).,0
Weather forecast Menslage this week Saturday,0
Category Blonde girls fucking Erotic sex videos First person porn videos Girls doing blowjobs Girls with big tits fucking Karmen Karma Keiran Lee Mature women fucking The best porn parody videos Tag Girls doing hot sex Girls with nice tits fucking Nymphomaniac Sexual adventures in everyday life Shaved pussy Couch Tattoos Women with big tits operated,0
"Beach service, including 1 beach umbrella and 2 sun loungers (at room), animation, mini club with babysitting, group dances, bowls",0
"The rapid response of economic policy, sound fundamentals, and a restoration of confidence provide a platform for recovery.",1
"In reality, the boot was on the other foot; China had not asked anyone to submit the draft resolution.",1
But that's not who we are anymore.,0
There was just total awareness of all.,0
He's almost out on his feet!,0
"""Instruction The """"competent medical authority"""" referred to in Section 38.11 may be a physician recognized by Health Canada, or other duly qualified medical practitioner acceptable to Health Canada.""",1
1 Free Try your future glasses you!,0
Next message: [grisbi-bugs] [Grisbi-0.6.0 0000755]: Some scheduled children didn't find their mother,0
"And you're not a fucking pool cleaner, either.",0
"This measure applies to actual taxable supplies made after March 21, 2013.",1
I can tell.,0
"Règles du jeu d'échecs - this site is devoted to the game of chess in all its forms: theory, tutorials, art and playing on the net and addresses itself to the enlightened amateur as well as the patzer.",1
Conclusion: Which One Are You Ready to Try First?,0
I know that my experience is not the product of my own genius; I know the work that I have done is not the outcome of my own ability.,1
"And we can help you! To download the game for free, we recommend you to select your phone model, and then our system will choose the most suitable apk files.",1
"6 `And the cities which ye give to the Levites are the six cities of refuge, which ye give for the fleeing thither of the man-slayer, and besides them ye give forty and two cities;",1
"I'm not people, I'm Ministry business.",0
I'm so mad about you,0
"Equal in performance, both turning spindles can be used to simultaneously cut two parts at one time.",1
"In this area, we find the most prestigious vineyards of the Patagonia and many of the wineries that make wines recognized at an international level.",1
An agreement in writing respecting minimum terms and conditions for work done by media industry workers that is in force when this section comes into force continues to operate for the duration of its term or such other term as may be prescribed.,1
"WIPO GREEN consists of an online database and network that brings together a wide range of players in the green technology innovation value chain, and connects owners of new technologies with individuals or companies looking to commercialize, license or otherwise access or distribute a green technology. Contact Us Site map",1
This can't be real.,0
"10 You shall live with us; and the land shall be open to you; live and trade in it, and get property in it.”",1
An unforgettable Christmas 2017 ... here small memories!,0
My legacy to be taken forward i.e the secretariat working in a consultative manner with the presidency in a collective and accountable manner,1
But that's so many hours.,0
But I turned down all of them (false prophets) including one who even wants to offer a bank to me.,0
"In particular, this work concerns the development of a drone guiding and positioning system using laser sensors, pointing on screens placed around the construction area.",1
We can design and print an extensive range of products so that you are always seen.,1
"Delegates adopted the decision, which, inter alia: welcomes the IWG report contained in ICCD/COP(12)/4; endorses the IWG science-based definition of LDN; decides that striving to achieve SDG target 15.3 is a strong vehicle for driving implementation of the Convention; and outlines specific actions to be undertaken by parties, the Secretariat, the GM and other stakeholders.Delegates adopted the draft decision.",1
"""I take it you’ve heard of that box.""""""",0
Here’s a look at the standings.,0
Questions & Answers Get quick answers from Durham House staff and past guests.,1
Thousands of bones were pulled out... They were tearing them out and throwing them away somewhere in the mountains.,0
He's worried about his jew-skin.,0
We didn't have probable cause.,0
An advantage of the EGF is that it can be used to finance measures tailored to the specific circumstances of each worker concerned.,1
What is Nigeria Domain name?,1
"Matter o' facts, so am I.",0
Gameplay starts the hero on the toilet of the gun.,1
Hard water is characterized mainly by the dissolved calcium carbonate which is deposited as scale on surfaces in contact with water.,1
"""» battleground - What rhymes with """"battleground""""?""",0
Both plants and animals are affected by the temperature and precipitation in their habitats.,1
1. Countries whose indicative share of internationally supported emissions reductions is less than 0.1% are not included in this list.,1
Take the RAG (F).,0
CA 6636/N is available in 7 additional attractive styles,1
Welcome to Costa Rica!,0
%30 deposit bonus and 25 free spins on the Sakura Fortune video slot machine at House of Jack casino,0
I was going to hell,0
"1000+ images about Dynamic Running Therapy on Pinterest | Running, Therapy and Keep Going",0
"In addition, people with schizophrenia have an increased risk of having other psychiatric conditions, including substance use disorders, depression, and anxiety.",1
"Travellers can easily leave too much – some countries don't even require tipping – or, worse, not enough.",0
The prayers show the profound love and longing for God. Every stanza of the prayers is by itself whole and entire.,1
This resistance line may act like a ceiling and repel prices lower.,1
Some reinforcements!,0
"There is no need to introduce it, the most famous Moroccan food in the world.",1
Buy Tom Ford Fender 799 50E 59 16 sunglasses in an easy and safe way at the best price in our online store.,1
"The method of claim 11, further comprising outputting a specified event when a use request not to inherit the sharing permission or a limited sharing permission has occurred.",1
"We invite papers on clinical and/or theoretical work, whether a single case-study or a general discussion using detailed clinical vignettes from several cases; and based in couple and/or family practice.",1
"We're healers, man.",0
Get there quickly Direct flights to Brisbane from Newcastle,0
"Our Robot,Signals and Software is totally FREE! Harry up and SIGN UP NOW",0
"She's heading back to boarding school, so... I jacked a horse and I beat the train there.",0
"You're a gangster, too, just like Zoran Brasha.",1
The Americans?,0
She says I'm good?,0
"Yeah, 'cause I thought you were smart enough to wait to pull the lever until you got the word.",0
"Yeah, I'm suspicious, she looks delicious.",1
"No warning, no phone call, nothing.",0
"To determine your interests, Google will track your behavior across the web using cookies.",1
Then I decided that this way I do not want to live anymore.,1
Accessories for shower cabs3,0
