text,label
"Do not worry about cash for the cab if you squander it all; most taxi drivers, especially the taxis booked by casinos, will take you to your house and are more than happy to wait for the moolah when you get home.",1
Today the product of this construction is both necessary and fragile.,1
"In this connection, the Ministers launched the Kobe Research Project, which is designed to facilitate inter-regional cooperative research and study activities on topics of mutual interest, such as regional monetary co-operation, exchange rate regimes under Asia-Europe co-operation.",1
Uh... a disease?,0
[2] It can also be used as a lubricant and a plasticizer.,1
How can I be the first one to know about your new products?,1
1) tracking number to track your package online.,0
At AutoZoom.ca Inc. near Laval you will find a vehicle that meets your needs at a great price.,1
"See, that's true love.",0
"In this context, Union confirms the following:",1
And she's gonna give birth... Not get to be a mother.,0
It is clear that this understanding of cultural heritage as a field of conflict also serves to stimulate solidarity in accepting the different.,1
"For signal transmission of multi ways cameras, we specially developed various signal cable composted with 13PIN to 22 PIN with separated shielding, and won customers’ highly speaking.",1
I've a lot of work to do.,0
- I said so. 3 dollars.,0
« The quality of strategic advice is highly satisfactory.,1
“Sharing these solutions across borders can create new opportunities to amplify their impact and contributes to shaping a better future.,1
The President of the Commission,0
"On the left of the symbol, a pair of numbers indicates the flow of the air in operating position. ACTUATION AND RETURN INTO REST POSITION The actuating mode and the type of return into the rest position are identified with special symbols, as shown in the figure below.",1
The contract has to be signed by all parties involved in its implementation.,1
An insane win will consist of multiple wild icons on Star Jackpots in the winning combinations.,1
"Three craft, separated by 2.5 million km in a triangular formation, will follow Earth in its orbit around the Sun.",1
"Okay, I'm done.",0
"According to Chinese theory, Yin is the passive force of the universe, and Yang, the active.",1
"Management, photos and aesthetic effects were all very innovative and also brilliant.",1
[Instahair] Party hairstyles: opt for braids to stand out from the crowd!,0
Wouldn't say why and she wouldn't answer my calls.,0
The Commission shall make publicly available the list of the bodies including the identification numbers that have been allocated to them and the activities for which they have been notified.,1
"""""""Communities have traditionally turned to charity-based models and food banks to meet the needs of people challenged with food security,"""" YAPC executive director Kristina Craig said.""",1
"- to move an oral amendment to Amendment 130, which was not accepted as more than 40 Members objected;",1
"Given Montserrat &apos; s vulnerability, and taking into consideration the current state of affairs, it may be necessary to establish permanent social safety nets to ensure that problems arising from social dislocation do not become chronic.",1
Title: The process of integration in a dead end?,0
Not even Marilyn Monroe herself.,0
"They do not take reality at face value but reconstruct it in a process in which everything interferes, including personal parameters such as their needs and wishes, but also their past, their experiences, their values, and their beliefs.",1
"If you have additional information about the FNX file, we will be grateful if you share it with our users.",1
"In his quest for perfection, his fascinating theoretical reflections on form extend those of Vincent d'Indy.",1
"Our map displays the areas and neighborhoods around all Polonvka hotels so you can see how close you are from landmarks and attractions, and then refine your search within the larger area.",1
How can she have these letters and move in with me and look me in the eye over breakfast and lunch and...,0
"Buses are available from the stations, Silom, Khao San Road, and Sukhumvit and from Hua Lamphong on the Skytrain.",1
The American College of Obstetricians and Gynecologists25 and the CDC recommend that individual obstetricians choose one of these protocols to establish consistent management of patients.,1
They were prison guards.,0
But he also signs the translation.,0
"Indeed, you constantly offer the Successor of Peter enlightened advice, based on your pastoral experience of the situation in the Church and in society on the African Continent.",1
"- No. - Oh, wait, wait.",0
"We're on for a three-hours show (interrupted with breaks, pricegivings...) with songs, playlets, a magician, dance, competitions...",0
- Why didn't you show up?,0
"Processes and analyses evidence in line with policy, standards and guidelines and supports production of forensics findings and reports. Navigation SFIA",1
What time is the first and last train of the day from Mulhouse to Reims?,1
The surveillance program must have the capacity to gather additional information to answer these questions.,1
Cheap train tickets to Provo from Florence,0
"PROCESSES: Category of cookie used to improve the operation of the PLATFORM, aiming for users to find the services and information they expect.",1
Triple bath Triple room with shower,0
But at least we have them.,0
"But you're back now, Jinksy.",0
"In the early hours of Saturday, the closing plenary was presented with a compromise decision resulting from ministerial-level consultations.",1
And keep a prize with me Until you go oh oh oh,0
"From basic literacy and numeracy support to specific skilled trades training to financial supports and work experiences offered to students, the Government provides a wide range of skills programming to meet a variety of needs.",1
"☛Lightning protection measure. From the above description, you could know that a lightning arrester is needed for LED screen outdoor projects. This is to protect the LED screen from a strong electromagnetic attack caused by thunder and lightning.",1
"To buy the domain, please fill out the form below and we'll contact you",1
I also ascertained that Mr. Virdi had not contacted the Board to provide any reason for his absence from the hearing.,1
"IP management is an essential element in the quest for a more equitable world, especially when seen as a tool to be used for public sector goals and by the public sector.",1
"A pedestrian street with bars and restaurants can be reached in 500 metres, whereas the shopping centre Mammut is set 300 metres away.",1
See all hotels in downtown Miami,0
Ben Sherman T-shirts for Men | Buy at the online outlet at a low price - dress-for-less,0
"Implemented March 2014.5.2.12 The mission has reviewed staff and position files to ensure they are complete, maintained and properly secured.",1
You writing your girl?,0
- The bus crashed.,0
None of that cheap stuff.,0
The examination and clinical examination here have a major importance to reach the diagnosis.,1
Earp! We've got a description of the van.,0
Receive up to 50% of the ticket price in the event of a cancelled or delayed coach journey.,1
Birgit2016-03-22T00:00:00Z I had a fantastic and wonderful time in my beautiful Delhi apartment.,1
"You can filter the type of flight if you only want direct flights to Huesca - Paris, multiple destinations or flight stopovers.",1
"Together, PHAC and CIHR are implementing an important research strategy with clearly defined research priorities to address an important infectious disease problem.",1
"Everyone stepped up to their best level so far, straight up no warm up. I could call everyones name right now but will stick to four guys that have really brought their A game all season long and deserves it: Truchon, Beardsley, Veilleux and Ojo, watch for these guys!!!",0
"While Total Gold Casino might offer online Gambling in Portugal, we will not recommend playing there.",1
"If you did not solve your problem by using a manual Pyle PT798SBA, ask a question using the form below.",1
And the contractor hired to build the sewers and water supply lines was?,0
The camera can be used to view images on a television-type screen.,1
"The signals END2 and END3 are processed analogously in the other units, and is understood that for a unit U2 incapable of functioning in the anticipated mode, the following always applies:",1
"Look, there's something I gotta get off my chest before you leave here!",0
I was startin' to get worried.,0
- Why did you pee?,0
- Are they coming?,0
"Top features, for less",0
So we keep learning.,0
A private cottage all to yourselves...,0
De The caves of Han + game park (highly recommended!!),0
Going on holiday to Tabasco?,0
Find out more,0
Located in New... close... more...,0
"Attractions and relaxation: Bar/pub, discotheque, restaurant, movie theater, karaoke, park and garden, leisure park, zoo/animal park, sea world, nature reserve, exhibition center, art gallery, historical site, museum, theater, opera house, festivals, antiques & bric-a-brac, local craftstore, cellar and wine tasting, casino, natural spring baths, thermal baths, sauna, steam baths, health spa, beauticians, fitness center",0
"NEW Finally they are done, our 2 lovingly furnished apartments in Mörbisch.",0
- Willingly?,0
"And this time, you won't be starting off all alone, 'cause you'll have Hubble.",0
"“We need the strong commitment of all Regions to enhance the benefit-sharing and the functioning of Treaty’s Multilateral System to exchange crop diversity,” said Mr Matthew Worrell, Chairman of the Sixth Session of the Treaty’s Governing Body.",1
"""This crops up quite frequently. Chances are that you have selected a single category for display and forgotten about it, so all the """"hidden"""" appointments are just in a category that is not currently set for display. Pick Appt Categories in the OPTIONS menu and then tap on the ALL button. All your appointments will now """"magically"""" re-appear! Also, if a new year has just started, remember to look in the correct year (!)""",1
"And this is a fight with a definite outcome for the regime, which is its downfall, and for the people of Iran, which is their freedom and victory.",1
"However, the data are being improved.",1
"Currently, you is able to see that hundreds a huge number of people searching for free Little from the Fish Shop movie watching it on the sweat house with connection to the internet.",1
"FreeFlight 6 is the dedicated piloting application for the new Parrot drone, ANAFI.",1
"But Steven, we've lost.",0
"Well, Jake ignored his father the entire time we were there, so...",0
How long does it take to get from Ivrea to Turin?,1
"The second owner, (from 2005 to present) then restored the car’s whole body back into good condition.",1
"As can be seen in FIG. 6, the vessel 500 comprises an indexing orifice 503 corresponding to the indexing part 133, in which the said part 133 will be inserted.",1
Network meetings Exchange between correspondents This section is intended to be a repository of the exchanges between correspondents on specific topics (which often concern a proposed new piece of legislation).,1
"-Well, it's not to my taste.",0
Where to stay in Danville,0
"In the event of your death, the insured balance of your loan is repaid.",1
OVER! The time when evenings and week-ends were dedicated to exams grading!,0
Le FILLE! So Charles was a Ali & Jason's brother who killed himself in Radley?,0
"More than ever, development and socio-economic advances will depend on the possession of knowledge and information.",1
"What poses do guys like, or How",0
"The concert by the Wrocław Philharmonic Orchestrais part of the Soldaat _BAR_ Lamentatie festival, a musical project organsied by DeBijloke,which was developed with a view to commemorating one hundred years since the outbreak of the First World War.",1
Days in the park?,0
"And contrary to what most TV cooking shows think, YOU CAN'T PUT CHICKEN BROTH IN A DISH AND CALL IT MEAT-FREE!!!!!!!!!",0
I voted for the Markov Report because I believe that the report is right to commend the role of the European Bank for Reconstruction and Development in aiding SMEs in the former Communist countries of Eastern and Central Europe.,1
You see I know all about you!,0
"The Indonesian Government and the highest commanders of the Indonesian Army violated international humanitarian law by targeting civilians; conducting indiscriminate military attacks, some involving the use of banned weapons like napalm; and pillaging and unnecessarily destroying civilian property;",1
"Shoes on the deck, body stuffed in the engine room.",0
"Book Now: The tour will be carried out upon demand for any group size in English or Spanish according to the majority of the public, we can also provide German, French and Arabic if there is a majority interested. Booking Voucher &amp; Instructions",1
The rooster Chantecler believed his crowing caused the sun to rise.,1
"Epic War is back, and more epic than ever before! Now with all new artwork, dozens of new units acro...",0
"Solutions and adaptations aimed at various levels have been studied for this purpose, to satisfy every specific requirement, with scheduled routine and extraordinary maintenance operations on the machines and plants.",1
However CIRDI does include mining companies as a critical stakeholder in the engagement process.,1
Five numbers.,0
"Oh, you don't have to pay her back.",0
Thinking about building your own affiliate system?,0
"However, the situation that appears to exist may be somewhat perplexing.",1
"Tiout has 2 communities: the Amazighs inside the ksar, and the Arabs around the ksar.",1
"For each newly acquired member you will get CHF 50,-, thanking you for your commitment for a strong union.",1
3 3 Weather forecast Gurnee next week,0
"The increase affects primarily persons after age 75 and over so that by age 85, about one half of Canadians experience at least one disability in relation to sight, hearing, cognition, mobility or manual dexterity.",1
Get a comprehensive overview and no bad surprise !,0
But I'm not surprised.,0
"Imagine being able to reduce the ambient volume, just as you do with your MP3 player or your Stereo system.",1
"Just pop in a CD, USB, or sing along to songs from YouTubeTM via Bluetooth®.",0
What I can do to you --,0
"brunette, toys, shaving, college, couple",0
#75624077 - Young beautiful woman with perfect skin and armpits care,0
"1 week ago 06:04 JizzBunker voyeur, milf, hidden, office, shower Chinese Hat Granny Taking a Shower",0
"Providing photos, videos or illustrations which do not depict the product or its use, or which depict people, is not permitted.",1
There are nice playgrounds for kids though even there parents won ́t find any possibility to take a seat.,0
"""Â In 2014, TPRF produced the video """"Citizens of the Earth """": In 2013, TPRF produced a series of videos for the International Day of Peace:""",1
The measures and decisions taken in the past must be combined and extended.,1
"Come on, elle, we've all asked him, and he won't say.",0
"The Dominion has something we want, so we need to find something they want...",0
I don't... I don't really know how to use this thing.,0
"52. The UNDP-financed project executed by INCAP entitled &quot; Transfer of technology of composite flour &quot; came to an end, achieving important targets.",1
"- I'll see you there. - Yeah, see you there.",0
"""As the IMF negotiations intensified in early March, Jubilee South/Americas released a communiqué reiterating its solidarity with the protests of the Nicaraguan movements and highlighting its concern that the IMF is pressing the government for """"reforms"""" geared to insure repayment of both the external and internal public debts claimed of that country and which have been clearly shown to be illegitimate.""",1
"I love the science, but out here's where all the action is.",0
Our goal is that both parties are satisfied in the purchase - sale.,1
Even your own country wants you dead! Ugh!,0
Just keep trying.,0
"I knew a Crowder or two, but no one by the name of Givens.",1
"Hello, is this the police?",1
Any word from Kathryn?,0
"""""""Any attempt to attack religion in the name of objectivity, of science or of reason is an enterprise doomed to failure, because we can no more suppress religious feeling than we can suppress other feelings.""",1
Was the October 1886 contract not in direct relationship with a pregnancy previously aborted in England?,1
The wind forecast over Sakurajima...,0
You can also request a quote from Mustafa (the owner) through the contact form.,1
-You look pretty.,0
"- No, I don't know these people!",0
Everyone is invited to join the conversation on Bell Let's Talk Day by sending messages of support across multiple platforms to drive both awareness and action in mental health.,1
Want Detailed Advice?,0
This is an unacceptable statistic which demands a strong response from lawmakers who have the freedom to speak out and act.”,1
So this is a great science.,0
It's always slow in here before those royal reviews.,0
"I mean, I've thought about this moment... what I would look like...",0
Our goal is to provide you with a quick access to the content of the user manual for Kodak EASYSHARE CD93.,1
"1:25 And taking in their hands some of the fruit of the land, they came down again to us, and gave us their account, saying, It is a good land which the Lord our God is giving us. < 1:26 But going against the order of the Lord your God, you would not go up: 1:27 And you made an angry outcry in your tents, and said, In his hate for us the Lord has taken us out of the land of Egypt, to give us up into the hands of the Amorites for our destruction.",1
"Montreal February 22, 2018: It is with great enthusiasm that the new events platform TRIBUTE, dedicated exclusively to celebrating the distilled spirits as well as other artisanal products from Quebec, wishes to announce its association with the Société des Arts Technologiques (SAT) as part of Montreal’s Nuit Blanche festivities!",1
- Thought you wanted food.,0
"10 days ago - Russia. Moscow, Male, freelancer",0
"- They don't say, and I don't ask.",0
"Your Committee, which was authorized by the Senate to incur expenses for the purpose of its examination and consideration of such legislation and other matters as were referred to it, reports, pursuant to Rule 104 of the Rules, that the expenses incurred by the Committee during the Second Session of the Thirty-fifth Parliament are as follows: With respect to its examination and consideration of legislation:",1
He wouldn’t let his partner down!,0
"If codes permit and a separate ground wire is used, it is recommended that a qualified electrical installer determine that the ground path is adequate.",1
"Towns to visit include Mont-Doré, quite similar in style to La Bourboule and further upstream on the Dordogne river, and the town of Clermont-Ferrand to see the imposing towers of the black cathedral and other historic monuments.",1
But the next day svyatoslav rowed in the boat with the others.,0
Not to william?,0
Weather forecast Pongola this week Wednesday,0
New offer: Collectable Daily Prizes for a month!,0
"That will not be easy; in fact, it could amount to tryingto square a circle.",1
The free movement of persons is a fundamental right guaranteed by the EU to its citizens and their family members.,1
Last time too you got in trouble and you couldn't get out.,0
"We're close, very close.",0
"Less than a week,huh?",0
"If the settings on your software that you are using to view this website (your browser) are adjusted to accept cookies we take this, and your continued use of our website, to mean that you are fine with this.",1
"- Ricky, we got a big problem here.",0
"A grace period of 36 months maintains the exemption until June 18, 2011, for First Nation governments.",1
The classic game reinvented in 3D for extra fun,0
"Dex didn't tell you about that? No...no, he didn't.",0
"Add to Likebox #3244991 - abstract acrylic painting with fish symbol, artwork is created..",0
"Fantastic apartment,it's near food city and arpico center,and the equipments are all ready,I'll recommend to my friends if they come to Colombo.Nice experience Victor2015-09-14T00:00:00Z",0
"I hope everyone understands that, when I speak of 'European values' and 'European political culture', I do not ascribe to such terms any geographical content or any 'Eurocentrism', because a political culture based on freedom and the rights of the individual embodies a universal system of values that is equally fitting for Europe and for Africa, for Russia and for China.",1
Just like I pretended to like Nana.,0
"All NVIDIA nForce Professional 3000 series MCPs feature a native dual Gigabit Ethernet controller that is connected directly to the HyperTransport link, which reduces the latency between the Ethernet controller and the CPU.",1
"Arrepentida Artists Isabel Pantoja Palos Copla Who bought these items, bought as well Flamenco music.",1
- I ain't loaning you no more money.,0
Home 10 Ideas for Celebrating World Radio Day 2019!,0
In many cases there is an active competition to see has the best decorations.,1
And the Schwarzbrunn outdoor programme will put you in a good winter holiday mood!,0
"The goals of this program are to ensure VIA Rail's equipment, stations and other capital assets are in a good state of repair, to improve safety and accessibility, and to improve passenger service, with particular emphasis on the Quebec–Windsor Corridor, which accounts for the bulk of VIA Rail's ridership.",1
"chocolate mousse for two6,00",0
"From its shape overhead lighting is desired, it is oriented to the north and to optimize the comfort of illumination but also ensure better thermal management of the building.",1
"Incidentally, he too had previously received a lengthy period of treatment in Hungary.",1
I play the shakers.,1
"43. Recalls that freedom of expression and media pluralism, including on the internet, are core European values; stresses the fundamental importance of press and media freedom in the EU’s enlargement policy and of digital freedoms in this context, considering these freedoms as human rights and therefore as part of the Copenhagen political criteria;",1
"(iii) when a significant change in a runway surface condition occur; (iv) following every accident or incident in which winter conditions may have been a factor, and",1
He is drinking ale with the gods.,1
"The study found that in patients taking Multaq, there were fewer hospital admissions for cardiovascular disorders (problems affecting the heart and blood vessels), particularly those related to atrial fibrillations.",1
Spit it out!,0
THE PICKPOCKET (making with his fingers the gesture of filching):,0
A greater degree of initiative on the part of programme managers is required to accelerate this process of refinement.,1
It is also a good walk to the beach (about 10 min.).”,0
"Moreover, the Theory of Relativity is incompatible",1
"Now, please, enjoy yourselves tonight.",1
"Created over the centuries, the cathedral is the dominant landmark of the castle.",1
"In this small and welcoming alpine station immersed in the Grand Paradis National Park you can breathe in an authentic mountain atmosphere, in harmony with the rhythms of nature.",1
"""To see and configure these options, press the Click to configure post options"""" link if it is available.""",1
At the same time the Montenegrin authorities agreed to honour the agreements of the Council of Bureaux for foreign vehicles whilst in Montenegro.,1
Hence she championed women’s education and enfranchisement not only on grounds of equity but because she believed that girls needed to be educated for their duties in the home and that factory work left them unprepared to assume their roles as wives and mothers.,1
"Secondly, the elements of the 2001 decision that have been complied with will be clarified.",1
124. The Secretary General introduced DR3.,1
So is that for drugs?,0
"Well, look at that.",1
"The method according to claim 1, further comprising, after step c):",1
- You let Joey drive it?,0
Best Hull Hotels Hotels.com currently has 7 hotels in Hull!,0
- Of course.,0
"He has been through enough tonight, Detective.",1
"While adults express themselves by dressing in a particular way or by adopting a distinctive lifestyle, children achieve this entirely naturally through",1
"However, the participants ask that special treatment and increased market access be awarded for the principal export products of ACP countries.",1
I can't let my dad know I'm inside the robot.,0
"We work with most OEMs and software vendors on VR / RA topics, as well as in the deployment of immersive applications to major players in the industry, entertainment, construction and Energy sectors.",1
"But this story between the two of us, it's not an article I can write.",0
"Today, things have changed.",0
90 days of work now...Millionaire Tomorrow $$$ (mon) map hide this posting restore restore this posting,0
"Ltd, with over 15 years experience of Tattoo, piercing and Permanent Makeup manufacturing,has become a leading tattoo manufacturer in China.",1
But I’d just like to know what’s happening.,0
"Although in those days our parliamentary delegation had observer status, time and time again it returned home from Strasbourg with new viewpoints and ideas to further our return to the fold of democratic European nations.",1
Add to Likebox #84600357 - Galloping on a horse of the sea at sunny day,0
I do not know.,1
Nate!,0
