text,label
"Commandés à distance, ces modèles offrent plusieurs programmes au choix et sont munis de deux moteurs pour une meilleure performance de nettoyage.",1
"""J'espère que tout le monde comprend que, lorsque j'évoque les """"valeurs européennes"""", et la """"culture politique européenne"""", je n'attribue à ces termes aucun caractère géographique ni aucun eurocentrisme: en effet, une culture politique fondée sur la liberté et les droits concrétise un système universel de valeurs qui vaut pour tous, Européens, Africains, Russes et Chinois.""",1
L’apôtre Paul a bien fait comprendre cette pratique aux Éphésiens lorsqu’il a demandé :,1
Conclusion: Lequel êtes-vous prêt à essayer en premier?,0
Je ne pense pas qu'il l'aura.,0
Quel est le moyen le plus rapide pour se rendre de Heathrow Terminal 5 (métro de Londres) à Shepherd's Bush ?,1
Mais d'une manière différente de celle-ci.,0
- Et je te choisis toi.,0
"Grande ouverture, grande fermeture !",0
Des billets de train à bas prix vers Provo de Florence,0
"Chaque chambre de confinement est spécialement construite pour contenir les effets anormaux de l'entité, pour qu'il évite de ruiner votre journée !",1
Que ce soit la fin de votre voyage de recherche d'un robot avec succès sur le Forex.,1
Formulaire d'inscription Remplissez le formulaire ci-dessous pour vous inscrire à cette formation : Ghisonaccia.,1
Il récupérera son argent.,0
"Les comités permanents chargés d'examiner un Budget des dépenses peuvent convoquer des témoins, dont le ministre et des fonctionnaires du ministère ou de l'organisme en question, ainsi que des particuliers ou des membres de groupes intéressés.",1
PUP.Optional.Adpeak f est un parmi ceux infection qui est capable de rendre votre PC corrompu et inutilisable.,1
"Viens, on rentre.",0
Je vous l'avais dit mais vous vous en foutez !,0
Nous espérons que ça n'arrive pas.,0
Vous croyez que c'est un moustique qu'on peut écarter comme ça?,0
"Souvent, il s'agit d'une compétition à savoir qui a le meilleur décor.",1
"On a déterminé le Jd de l'alcool laurique à divers taux d'agitation du milieu, et à différents sites de l'intestin et ce, chez des animaux de divers âges, de différents espèces, chez des rats au diabète mellitus induit par streptozotocine, suite à une irradiation abdominale, à une exposition chronique à l'éthanol, et à diverses diètes alimentaires.",1
Vous pouvez obtenir de telles informations de plusieurs manières.,1
Découvrez pourquoi Glice est si différent !,0
"La Commission rend accessible au public la liste des organismes, assortie du numéro d'identification qui leur a été attribué ainsi que des tâches pour lesquelles ils ont été notifiés.",1
"Le service de plage, qui comprend 1 parasol et 2 lits (par chambre), divertissement, mini-club avec baby-sitters, danse de groupe, terrains de boules",0
Je vais vite remplir ça.,0
J’imagine que tu as entendu parler de cette boîte ? »,0
Imaginez baisser le volume ambiant comme vous le faites avec votre lecteur MP3 ou votre chaîne Stéréo.,1
Arthur: Je ne fais que mon travail.,0
- Comment vont les autres?,0
"Pour les personnes qui travaillent dans un environnement international et entretiennent des contacts écrits et oraux en anglais avec leurs collègues, clients ou fournisseurs.",1
"1:25 Et ils prirent dans leurs mains du fruit du pays et nous l'apportèrent, et ils nous rendirent compte et dirent: Le pays que l'Éternel, notre Dieu, nous donne, est bon. < 1:26 Mais vous ne voulûtes pas monter, et vous fûtes rebelles au commandement de l'Éternel, votre Dieu. 1:27 Et vous murmurâtes dans vos tentes et vous dîtes: C'est parce que l'Éternel nous hait, qu'il nous a fait sortir du pays d'Égypte, afin de nous livrer aux mains des Amoréens, pour nous détruire. Où monterions-nous?",1
Stop ! Recrache !,0
La température et les pluies ont des conséquences sur les habitats des plantes et des animaux.,1
[2] il peut également être employé comme lubrifiant et plastifiant.,1
"(Arrêt à Amalfi environ 1 heure) - Comme dernière, visite à Vietri sul Mare capital indiscutable de la céramique artistique.",0
Tu l'as déjà fait sur moi ?,0
Il est clair que cette compréhension du patrimoine culturel en tant que champ de conflit servent également à encourager la solidarité en acceptant différents.,1
Combien de temps faut-il pour se rendre de Gare de Turin-Lingotto à Turin ?,1
Vous n’avez qu’à me suivre et nous réduirons ce stupide sapin en pièces”.,0
"Malgré le retour des soldats, le Bleu-Blanc-Rouge gagne en effet la coupe Stanley contre les Bruins en 1945–1946.",1
"L'espèce a plusieurs caractéristiques, comme un manque relatif d'agressivité, une taille gérable, une maturité sexuelle précoce, un caractère sociable et des taux de reproduction élevés, qui font qu'elle est particulièrement facile à apprivoiser.",1
- Un connard !,0
Un chalet privé tout à vous...,0
La maison est grande et décorée avec goût.,1
"Donc, si vous vous imaginez un guerrier de fin de semaine, un peu de formation à l'équilibre pourrait vous rendre beaucoup mieux.",0
La Conférence invite donc les institutions à adapter en conséquence les dispositions pertinentes.,1
Un Noël 2017 inoubliable ... ici de petits souvenirs!,0
"MeasureMesure de protection contre la foudre. De la description ci-dessus, vous pourriez savoir qu’un parafoudre est nécessaire pour les projets extérieurs avec écran LED. Ceci afin de protéger l'écran LED d'une forte attaque électromagnétique causée par le tonnerre et la foudre.",1
"Si vous avez d'autres questions, s'il vous plaît envoyez-moi un message comme par le portail, je suis heureux de répondre à vos questions.",1
Il faut voir les Yankees.,0
Télécharger des images et de les afficher de façon attrayante.,1
Ilaria Commencez à échanger votre maison !,1
- Du nouveau pour l'Italie ?,0
Tu vas bien ?,0
Laisses-nous seul désormais.,1
"Mais saviez-vous que, selon votre canton de résidence, ces pénalités sont déductibles fiscalement et qu’elles peuvent éventuellement être intégrées dans le montant de votre prêt souscrit auprès de Crédit Agricole next bank ?",1
"Compte tenu de la vulnérabilité du pays et de la situation actuelle, il faudra peut-être créer des systèmes permanents de protection sociale afin d &apos; éviter que les problèmes créés par la désorganisation sociale ne deviennent chroniques.",1
Je veux pleurer mais je suis trop macho.,0
Et ensuite elle s'est évanouie.,0
Elle vous en a parlé ?,1
