text,label
"L'Ontario a nommé une nouvelle juge à la Cour de justice de l'Ontario, avec effet au 22 juin 2016.",1
"2. Le DPF devrait rappeler à tous les détenteurs de cartes d’achats et aux gestionnaires qu’une autorisation, en vertu de l’article 32 de la LGFP, doit être obtenue du titulaire du budget pour tous les achats effectués par une carte d’achat, quelles que soient leurs valeurs.",1
Ça va allez.,0
Chez Hyundai Casavant près de St-Hyacinthe vous trouverez un véhicule qui correspond à vos besoins ainsi qu'à votre budget.,1
"Un totem est une chose, mais elle est bien plus puissante que tout ce que nous avons pu voir.",0
"Non, il n'y a rien ici.",0
"La mise en ligne de photos, vidéos ou images, qui ne présentent pas le produit, voire ces avantages, de photos de personnes n’est pas autorisée.",1
J'ai pensé à ce moment... A... à quoi je ressemblerais... ce que je dirais.,0
"Ajoutez à la Visionneuse #3244991 - résumé la peinture acrylique avec des poissons symbole, les oeuvres..",0
"Ce boîtier de transfert a une performance de simulation très élevée de la vraie, augmente l'authenticité de votre voiture.",1
Phen375 Halifax Canada: Commentaires Et Où Acheter ?,0
"Par exemple, pour citer un texte écrit par M. Dupont, vous devrez entrer:",1
Tout comme je faisais semblant d'aimer mamie.,0
2 Le Seigneur de la Galaxie Tachyon boosters,0
Je te donnerai des hommes qui veulent gouverner le monde.,1
❍ Garder le couvercle sur la carafe lorsque l'appareil est utilisé.,0
"La nouvelle configuration triangulaire entre les Song du Sud, les Jin et les Xia occidentaux prolonge la période de division et de conflits en Chine.La région du Huainan (entre les fleuves Yangzi Jiang et Huai He) devient la nouvelle zone frontalière et le théâtre de combats entre Song et Jin entre 1128 et 1141, contraignant ainsi des milliers de familles vivant dans la région depuis des générations à fuir[78].",1
"Puis vient son cœur chaleureux, un bouquet floral où le jasmin tient la vedette.",1
"Les données centralisées facilitent le suivi permanent du fonctionnement des installations, apportent une meilleure connaissance du réseau et permettent d’en optimiser le fonctionnement.",1
"- Une grosse qui tombe ? Non, mais c'est drôle.",0
"Je vous en prie, profitez bien de votre soirée.",1
- Volontairement ?,0
La caméra permet l'observation des images sur un moniteur de type télévision.,1
"Toutefois, les délégués demandent qu'un traitement particulier et un accès accru aux marchés soient accordés aux principaux produits d'exportation des pays ACP.",1
- Et si elle n'est pas seule?,0
"Swastika — Écoutez, regardez, téléchargez et découvrez gratuitement de la musique sur Last.fm Précédent",0
Je peux le deviner.,0
La force de Digitalis repose sur son ergonomie et sa capacité à s'adapter à vos besoins spécifiques.,1
Nous pouvons utiliser vos informations personnelles pour vous envoyer des informations promotionnelles sur des tiers qui nous pensons susceptibles de vous intéresser si vous nous dites que vous voulez que cela se produise.,1
Renseignez-vous sur l’approvisionnement en matière de défense et sur la façon de soumettre des projets de publicité au ministère de la Défense nationale.,1
"Pour la transmission de signal des caméras multi de manières, nous avons particulièrement développé le divers câble de signal composté avec 13PIN à PIN 22 avec l'armature séparée, et les clients gagnés parlant fortement.",1
52. Le projet de transfert de technologie en vue de la production de farines composées qui est financé par le PNUD et exécuté par l &apos; Institut de la nutrition pour l &apos; Amérique centrale et Panama (INCAP) s &apos; est achevé avec de bons résultats.,1
Plus de cette chambre d'hôte à Ophemert,0
Merci pour l'ajout.,1
"Le Passbask est le pass international transfrontalier avec lequel vous pourrez voyager jusqu’à Bayonne, avec Euskotren et SNCF, avec un seul billet et de manière illimitée pendant la période de validité du billet.",1
Il nous faudrait...,0
"Mon psy dit que je dois sortir, mais...",0
Je n'aime pas ce spectacle.,0
"Le Gouvernement indonésien et les plus hauts responsables de l &apos; armée indonésienne ont violé le droit humanitaire international en s &apos; en prenant à des civils; en menant des offensives militaires aveugles, à la faveur desquelles ils ont parfois utilisé des armes interdites comme le napalm; et en pillant et en détruisant sans raison les biens de la population civile;",1
L’un de ses avantages est qu’il peut être utilisé pour financer des mesures adaptées à la situation spécifique de chaque travailleur concerné.,1
Le meilleur du mois hellu 8 points.,0
Il veut que j'aille le voir pour toucher ces biceps et plus ! Rachel: Tu rigoles ?,0
J'étais au Hoser Hut...,0
Je vais apporter le gâteau.,0
SIXT Location de voiture dans les aéroports près de Saint-Louis,0
"3 Pour autant que je puisse le déterminer, cette page en particulier, 4 avant que je ne renonce à pousser plus loin mes recherches à ce sujet parce 5 que je pensais qu'on n'évoquerait pas ce document, cette page particulière 6 n'a pas de rapport avec le témoin.",1
Vous ne pensez pas que je suis un peu trop qualifiée pour ça ?,0
"Suivez ce lien pour avoir un avant-goût filmé de Robin et Marion, une magnifique pièce savamment interprétée par Renaud Lacelle-Bourdon, Gabriel Lessard, Kim Despatis et Marilyn Perreault. Un texte magique d’Étienne Lepage et une mise en scène exquise de Catherine ... Continuer la lecture →",1
Où séjourner à Perryville,0
QuitNow! PRO - Arrêter de fumer - 4.0 en dehors de 5 basé sur les 4 votes,0
"Notre Robot,de Signaux et de Logiciel est totalementGRATUIT! Harry up and SIGN UP NOW",0
Quand se rendre à Veazie,0
Le monde s'est uni pour trouver une réponse à la crise économique mondiale.,1
— Ah... oui... (Il met beaucoup plus de temps qu’il ne devrait à le trouver sur leur site.),0
"Insérez simplement un CD ou une clé USB, ou chantez en cœur des chansons de YouTubeMC au moyen de BluetoothMD.",0
Obtiens 10% de rabais sur les excursions de canyoning avec ta carte de membre HI.,0
"*Donc, Charles était un enfant DiLaurentis, frère d'Alison et de Jason, mais est mort en se suicidant à Radley?",0
Voir tous les hôtels au centre-ville de Miami,0
"Pour moi, c'est vraiment...",0
"La résurgence des attentats‐suicides depuis le déclenchement de la seconde Intifada en septembre 2000, qui visent les civils israéliens ainsi que des militaires ont fait, jusqu’à présent, plus de 900 morts et des milliers de blessés, constitue la principale préoccupation d’Israël sur le plan de la sécurité.",1
N'y a-t-il que les Esprits élevés qui remplis-sent des missions? « L'importance des missions est en rapport avec les capacités et l'élévation de l'Esprit. L'estafette qui porte une dépêche remplit aussi une mission mais qui n'est pas celle du général. »,1
"Pour sa virtuosité dans la présentation d'un stop-motion riche et baroque, monté sur un rythme halluciné d'un épisode fou, rejouant le traumatisme de l'abus sexuel et ses échos d'une surprenante ironie.",1
- C'est une blague ?,0
Gare à ses pieds!,0
Faites voter fiablecourse à vos amis !,0
"- Non, je ne les connais pas !",0
J'aime bien.,0
Le Frida... fermer... plus...,0
Les plus chaudes vidéos de sexe de famille endormies mettant en vedette de vrais amateurs - seulement à Night Penetration !,0
"Cette longue xylophone et maillets en bois de 27cm , les deux premières chansons sonnent très professionnel .",1
- En prison ?,0
Et c'est pour ça que tu dois...,0
Emoticon télécharger et détails - Coups de coeur battant,0
Mais cela ne nous sommes plus qui.,0
"La même chose, quoique dans une moindre mesure, va pour l'emballage.",1
"Quant à nous, nous ferons notre effort à Lausanne, et ceux qui veulent venir a notre fête sont chaleureusement invités.",1
"L'« autorité médicale compétente » dont il est question à l'article 38.11 peut être un médecin agréé par Santé Canada, ou tout autre professionnel de la santé dûment qualifié et qui est reconnu par Santé Canada.",1
4 SACE Adelaide a été crée en 1987 et est leader en formation de langue anglaise.,1
"Tous les MCP NVIDIA nForce Professional série 3000 sont dotés d'un contrôleur Gigabit Ethernet natif directement connecté à la liaison HyperTransport, ce qui réduit la latence entre le contrôleur Ethernet et le CPU.",1
"Ainsi, l’Union confirme les points ci-dessous :",1
Ce village provençal propice à l'évasion vous accueillera au mieux dans l'un de ses hôtels de charme.,1
Toutes les deux!,0
"516. Les centres de soins primaires ont intégré, en 2002, un nouveau programme destiné aux enfants intitulé &lt; &lt; Programa del nen sa &gt; &gt; (Programme de suivi de l &apos; enfant sain), dont les objectifs généraux sont les suivants:",1
"Naidoo a aussi insisté sur le fait que « la crise du changement climatique pourrait être convertie en une opportunité », preuve en est l’alliance qui a vu le jour entre les syndicats et les mouvements écologistes.",1
"C’est pourquoi nous revendiquons le droit de prendre des mesures allant dans le bon sens, y compris l’instauration d’un contrôle des capitaux et de tout dispositif permettant de préserver les salaires et les pensions.",1
Ca n'a rien à voir avec eux !,0
Next message: [grisbi-bugs] [Grisbi-0.6.0 0000746]: les frais ne sont pas pris en compte dans les montants,0
- Tu voulais pas manger ?,0
The post Une étude révèle le degré de sensibilité au genre des partenariats mondiaux public-privé pour la santé appeared first on SUN.,1
Et voilà que je peux plus ouvrir mes yeux !,0
"Pas même Marilyn Monroe, elle même.",0
"Comme on peut le voir à la figure 6, la cuve 500 comporte un orifice d'indexation 503 correspondant à la pièce d'indexation 133 dans lequel ladite pièce 133 sera insérée.",1
"Il l'y a emmenée, et il est resté jusqu'à sa mort.",0
Les filiales françaises aux Etats-Unis exportent chaque année près de 23 Md USD de biens depuis le sol américain vers des pays tiers (BEA).,1
14.1 Les présents Termes du Contrat avec les Utilisateurs sont régis par la loi de la République italienne.,1
Je m'en fais pas pour ça.,0
Je sais pas trop comment me servir de ce truc.,0
- Tu es belle.,0
Les annonceurs et/ou autres fournisseurs de contenu pouvant apparaître sur ce site Web pourraient utiliser des témoins qui ne proviennent pas du site de Kérastase.,1
De Les grottes de Han parc de jeu + (fortement recommandé !!),0
« C’est vraiment très différent de Madrid » dit elle avec un joli sourire !,0
"Le Chef Jean-Luc Tartarin et son équipe mettent leur savoir-faire au service d'une cuisine de grand-mère, généreuse, et vous accueillent pour un moment gourmand et chaleureux.",1
Voyage en autocar de ligne Obtenez jusqu’à 50% du prix du billet en cas de transport par autocar annulé ou retardé,1
"Procédé selon l'une des revendications 1 à 7, comprenant après l'étape c) des étapes consistent à:",1
"Mais j'aime ça, c'est sûr.",0
"Diana 2014-03-03T00:00:00Z Encore une fois, j'ai eu une très agréable à Ben et la maison de Prachi.",1
J'ai beaucoup de travail à faire.,0
"Les ministres responsables, entre autres, de l’environnement, des services sociaux, des transports et de la sécurité routière, et des affaires autochtones et du Nord ont tous tenu des rencontres fructueuses.",1
Lire aussi: Petit-déjeuner romantique: Surprenez qui vous aimez avec ces idées,0
"En outre, étant donné qu’il est un dérivé de DHT, il est structurellement incapable de convertir à l’œstrogène, de sorte que les personnes qui pourraient être sensibles à gynocomastia ou la rétention d’eau ne sont pas réellement besoin de se tracasser à ce sujet des problèmes émergents.",1
Réservez Avant Vos Vacances D'été 2020 En Toscane!,0
"Anthony Delaplace : « On est sorti à 11 coureurs, c’était intéressant.",0
"A quelques kilomètres de là, il y a des sentiers courts avec des abris et des paniers-repas.",0
"""Un autre problème, auquel la plupart des gens sont confrontés lorsqu'ils cherchent une thérapie, est la tendance à appliquer le terme de """"co-dépendance"""", qui suppose à l'origine un partenaire ou une personne dépendante de drogues, à toute interdépendance, décourageant ainsi tout espoir de relation vraiment intime.""",1
Pour augmenter l'image grenouille dans le lac appuie sur un gauche bouton de la souris.,1
- Je vais vous expliquer!,0
La base de données est développée pour l'usage interne par plusieurs utilisateurs (opérateurs).,1
"4.2 Le CESE considère que les ITC et les PPP contractuels représentent une expérience positive de création de partenariats européens s'ils sont en mesure de rassembler dans un cadre pluriannuel des fonds européens, nationaux et privés, un savoir-faire et des capacités de recherche et d'innovation, dans le but de partager les connaissances.",1
Qu'est-ce que tu fous?,0
"Il y a 10 jours - Russia. Moscow, Homme, freelancer",0
Achetez d’es maintenant votre Tom Ford Fender 799 50E 59 16 lunettes d'une manière facile et sécuritaire au meilleur prix dans notre boutique en ligne.,1
Prévisions météo pour Bersenbrück cette semaine,0
"Ce panorama volcanique si particulier est quelque chose d'unique que je vous recommande vivement, et vous n'avez pas besoin d'être un expert en trekking pour en profiter (couvrez-vous juste et oubliez les tones.",0
"- C'est mon camion, en effet.",0
Cette ligne de résistance pourrait fonctionner comme un plafond et pousser les prix vers le bas.,1
"Notre licence et notre réglementation sont homologuées par la Malta Gaming Authority.Nous nous sommes donc engagés à respecter les normes internationales.En outre, afin de garantir notre conformité, nous sommes soumis à des audits indépendants et à l'autorité de l'organisme e-Commerce Online Gaming Regulation and Assurance (eCOGRA).",1
- Pourquoi tu as pissé ?,0
"“Excellent hotel, tout est parfait, la chambre est...”",0
"À partir d’un échantillon d’inspections examiné, on constate que ces procédures sont appliquées de façon uniforme, à quelques exceptions près, essentiellement liées à la tenue des réunions de clôture avec les titulaires de permis et à l’obtention d’un avis confirmant qu’ils ont bien reçu les observations de l’inspection.",1
- Qu'est-ce que ca signifie?,0
Notre objectif est que les deux parties sont satisfaites dans l'achat - vente .,1
"Les PVVIH devraient éviter les vaccins contre le choléra, la typhoïde, la fièvre jaune et la variole.",1
Nous recommandons plutôt que les ACVM envisagent de considérer comme des émetteurs de premier rang ceux dont les valeurs mobilières sont cotées à la Bourse de Toronto et comme des émetteurs de second rang ceux dont les valeurs mobilières sont cotées à la Bourse de croissance TSX.,1
"Les délégués ont adopté la décision qui, entre autres: accueille avec satisfaction le rapport du GTI inclus dans le document ICCD/COP(12)/4; approuve la définition scientifique de la NDT donnée par le GTI; décide que les efforts visant à atteindre la cible 15.3 des ODD est un moyen fort de conduite la mise en œuvre de la Convention; et décrit des actions spécifiques que les Parties peuvent entreprendre, ainsi que le Secrétariat, le MM et d'autres parties prenantes.",1
"Pendant le terme de mai, les majors et les mineurs espagnols visitent des sites d'intérêt culturel et étudient à Heredia, au Costa Rica; Les études françaises / françaises majeures et mineures se rendent dans un institut de langues à Paris; Études allemand / allemand majors et mineurs visitent plusieurs villes en Allemagne.",1
Tu écris à ta fiancée?,0
"30.1 Paroles d'Agur, fils de Jaké. Sentences prononcées par cet homme pour Ithiel, pour Ithiel et pour Ucal. 30.2 Certes, je suis plus stupide que personne, Et je n'ai pas l'intelligence d'un homme;",1
Et vous savez ce qui est effrayant est-il réellement goûté sorte d'amende.,0
"Quant au vent, les prévisions autour de Sakurajima...",0
- Du début !,0
"Elle ne prônait donc pas l’émancipation et l’éducation des femmes uniquement au nom de l’équité, mais aussi parce qu’elle croyait que les filles devaient avoir de l’instruction pour bien jouer leur rôle au foyer et que le travail en usine ne les préparait pas à assumer leurs fonctions d’épouse et de mère.",1
J'ai passé mon examen de conduite ce matin!!!,0
Quand la nuit fera tourner la boussole,0
"Et contrairement à ce que la plupart des émissions de cuisine TV pensent, VOUS NE POUVEZ PAS METTRE BOUILLON DE POULET dans un plat et l'appeler sans viande!!!!!!!!!",0
"17 R. Je vous ai dit qu'au nouveau cimetière, il y avait 938 victimes qui ont",1
"Mais si vous aimez l'art, la National Gallery doit être sur votre liste de choses à faire.",0
Questions et réponses Obtenez des réponses rapides du personnel et des anciens clients de Casa Renada.,1
Ils les a tués tous.,0
Ce document expose la démarche ayant servi à élaborer les estimations et projections contenues dans le rapport principal.,1
"Nous, petits humains à l'esprit étroit, nous ne sommes pas le nombril de l'univers.",0
Mon père ne doit pas savoir que je suis dans le robot.,0
Cela ne peut être vrai.,0
Comment récupérer des données lorsqu'il est impossible de saisir un mot de passe sur le Samsung S7,1
"Il est également couramment utilisé dans les matériaux de construction, les plastiques et vous l’avez deviné ... dans les vernis à ongles.",0
Le rapporteur l 'a d' ailleurs évoqué dans son intervention.,1
Je ne dirais pas pourquoi et elle ne voulait pas répondre à mes appels.,0
Voici les 5 plus grands marathons au monde:,0
Ses cheveux rouges ne mentent pas!,1
Cette mesure s'applique aux fournitures taxables réelles effectuées après le 21 mars 2013.,1
"Les signaux END2 et END3 sont élaborés de façon analogue dans les autres unités et bien entendu, pour une unité U2 ne pouvant pas fonctionner en anticipé, on a toujours: EPMATHMARKEREP",1
"L'Agence de santé publique du Canada??L'Agence de santé publique du Canada, bien que n'étant pas une organisation partenaire, a fourni des fonds au IRSC pour cette étude, sous forme de subvention.?La mission de l'Agence de santé publique du Canada (ASPC) est de promouvoir et de protéger la santé des Canadiens grâce au leadership, aux partenariats, à l'innovation et aux interventions en matière de santé publique.",1
Et le programme plein air Schwarzbrunn veille encore à une bonne humeur d‘hiver!,0
"Mais j'ai parlé avec Carol et elle m'a expliqué ta situation, et j'ai réalisé que je t'avais peut-être... tu sais, juste.. mal jugé, donc je m'excuse.",0
"""Pour voir et configurer ces options, cliquez sur le lien Cliquez pour configurer les options des messages"""", si disponible.""",1
Une eau calcaire se caractérise essentiellement par du carbonate de calcium dissous qui se dépose sous forme de tartre sur les surface en contact avec l'eau.,1
Je l'ai fait avec mes vêtements.,0
Vous ne savez pas quel type de fichier DQY vous avez ?,0
▶ Nouvelle offre: des prix quotidiens à collecter pendant un mois!,0
Réservez une location de voiture chez addCar à Varna Airport par l’intermédiaire de Rentalcars.com et vous pourrez modifier votre réservation sans frais.,1
Il est également une bonne marche de la plage (environ 10 min.). »,0
"Naturellement, la description qui vient d'être faîte ne concerne qu'un mode de réalisation possible de l'invention, d'autres formes de réalisation étant néanmoins possible.",1
"L'invention sera mieux comprise à l'aide de la description suivante d'une forme de réalisation d'un dispositif de sécurité selon l'invention, en référence au dessin annexé, sur lequel :",1
"Ivy rose essaie de pianer le casque d'un fougueur célèbre sur xxxpawn,",0
La CCG a envoyé une note de service aux membres de l'industrie en juillet 1999 pour les informer des plaintes formulées à l'égard de la non-conformité aux dispositions du règlement et les inviter à transmettre leurs commentaires pour savoir si les dispositions devraient être conservées ou abrogées.,1
La couleur ressemble beaucoup au bleu Klein avec de drôles de cornes qui jaillissent de la toile et viennent jouer avec la lumière très forte qui la surplombe.,1
Nous avons mené des enquêtes sur les sites de réseautage social et nous avons traité des questions intéressantes soulevées par la technologie de l'imagerie à l'échelle de la rue servant à représenter nos villes sur des cartes.,1
"Angel, ces fusils ne l'empêcheront pas de piller les villages.",0
Les participants avaient le droit de changer d'option durant l'étude et recevaient une compensation financière lors de chaque visite à la clinique.,1
"Rien n'a changé, alors non.",0
Il faut prendre l’Eviplera une fois par jour avec un repas.,1
4 Prévisions météo pour Hatch la semaine prochaine,0
Le rapport indiquait que les progrès réalisés en matière d’alignement sur l'acquis restaient limités.,1
Retour /Informations sur la société Comment puis-je trouver un magasin à proximité?,1
Bob Burke est notre tueur.,0
"J'aime la science, mais ici la ou l'action est.",0
"Bien sûr, nous aimerions que chacun achète réellement une copie matérielle du CD, mais si quelqu'un nous écoute d'abord après un téléchargement et aime ça, c'est déjà une victoire pour nous, tu sais.",0
C'est mon premier cours de cuisine.,1
Je n'ai rien à t'offrir Que ce que mes yeux voient,0
SECTEURS EN EXPANSION Le gouvernement de Nairobi a entrepris une série de discussions avec des partenaires internationaux dans le but d'accroître la contribution des investisseurs étrangers dans la croissance du secteur agricole qui représente encore le pilier de l'économie nationale et fait vivre le 75% de la population.,1
- Ça vient ?,0
"Pour accélérer la mise en application de la budgétisation axée sur les résultats, il importe d'élargir la marge d'initiative des responsables de programme.",1
Mais je peux vous...,0
7:00 2 asiatique filles lotion sur corps Jouir tandis que putain de avec doubledildo et stra AsiatiqueGrosse chatteDouble,0
« Partager ces solutions au-delà des frontières permet de créer de nouvelles opportunités d’amplifier leur résonnance et de façonner un monde meilleur.,1
"Parmi leurs activités caritatives notables, le couple a contribué sans relâche au bazar de la Résidence Saint‐Louis, organisé deux fois par an.",1
"Enfin, ils sont faits, nos 2 appartements meublés avec goût dans Mörbisch.",0
"Tandis que Total Gold Casino pourrait proposer des jeux de hasard en ligne dans Netherlands, nous ne recommandons pas le jeu là.",1
"Le Parlement européen a repris les grands principes des propositions de la Commission, notamment sur le plafonnement des aides, le verdissement de 30% des paiements directs ou encore une politique de développement rural plus adaptée à la diversité des défis locaux.",1
Il est pentu et peut donner des frayeurs (chutes de pierres).,0
"Des bus sont disponibles aux stations Silom, Khao San Road, et Sukhumvit, et de la station Hua Lamphong de Skytrain.",1
"L'étude a révélé que chez les patients prenant Multaq, il y avait eu moins d'hospitalisations dues à des troubles cardiovasculaires (problèmes affectant le cœur et les vaisseaux sanguins), en particulier ceux liés aux fibrillations auriculaires.",1
Il est agréable qu'il n'y ait pas de limites de temps et ne pas être distrait par l'accumulation de points.,1
"* Nous offrons QS4A215Q1 pour prix compétitif sur le marché mondial, s'il vous plaît envoyez-nous une demande de quota pour les prix.",1
"La protection des travailleurs migrants, les campagnes contre la discrimination, l'égalité de traitement et l'encouragement à l'intégration sont également autant d'actions concrètes et essentielles pour que les migrations contribuent de manière importante et positive au développement économique et social des pays d'accueil et des pays d'origine.",1
124. Le Secrétaire général présente le projet de résolution DR3.,1
Nous avons trouvé 2 hôtels à Sharptown,0
Nous prions avec eux:,0
"Lorsque vous ajoutez des disques non permanents partagés en lecture seule à une machine virtuelle à l'aide d'API Unidesk, la machine virtuelle peut cesser de répondre.",1
Je–j’ai détourné la tête. Je ne pouvais pas supporter cela...?... sorti de la chambre.,0
"En raison de sa faible toxicité et de la douceur de ses propriétés essentielles, la chaux éteinte est largement utilisée dans l' industrie alimentaire pour:",1
"Ce résultat a été atteint, conformément à l'invention, en adoptant un procédé qui prévoit de:",1
Vous avez déjà une théorie.,0
Le système d’appel patient/infirmière est intégré dans les têtes de lit hospitalières pour faciliter leur installation.,1
"Pas tout près des restaurants, choix limité dans le restaurant d'hôtel",0
"mousse au chocolat pour deux6,00",0
J'ai de l'avancement. La laverie de l'oncle.,0
"Tout le monde est invité à se joindre à la conversation pendant la Journée Bell Cause pour la cause, en envoyant des messages de soutien sur diverses plateformes afin d'accroître la sensibilisation et d'encourager des actions en faveur de la santé mentale.",1
"Si vous avez séjourné à B&B 't Huys van Enaeme ****, faites-nous savoir ce que vous en pensez et aidez es autres à faire un bon choix !",0
