text,label
Écouter maintenant Détendez-vous et profitez d’une sélection de lounge ambient.,1
"Clerprem a, quant à elle, été primée dans la catégorie des fournisseurs de moins de 500 employés pour l'innovation remarquable dont elle a fait preuve au chapitre des produits, notamment en utilisant un siège ultraléger pour améliorer la performance environnementale, et pour son engagement social à respecter les normes rigoureuses de ses clients.",1
Ce show est vendu par FunBrunettee,1
"Il nous a fallu un peu plus de temps pour obtenir celui-ci libéré, mais il était certainement la peine d'attendre!",0
Tu la prêtes à Joey ?,0
"10 Vous habiterez avec nous, et le pays sera à votre disposition; restez, pour y trafiquer et y acquérir des propriétés.",1
"Si les paramètres de votre logiciel que vous utilisez pour afficher ce site Web (votre navigateur) sont adaptés pour accepter les cookies, nous prenons ceci, et votre utilisation continue de notre site Web, pour signifier que vous êtes d'accord avec cela.",1
Il est en train de boire de l'alcool avec les dieux.,1
Comment obtenir le numéro de build / version de votre application Android?,1
Il a alors fait part de notre intention d &apos; apporter une contribution au désarmement nucléaire et à la non—prolifération dans le cadre des mécanismes du Traité.,1
(iii) s'il se produit une modification importante de l'état de la surface de la piste; (iv) après tout incident ou accident dans lequel les conditions hivernales pourraient avoir joué un rôle;,1
"En quête de perfection, ses passionnantes réflexions théoriques sur la forme prolongent celles de Vincent d'Indy.",1
"Enfin, voyez si vous travaillez mieux avec ou sans musique, et préparez-vous en fonction de ce choix.",1
il/elle se serait énamouré/énamourée,0
10:3 On le fit appeler et il vint avec tout Israël. Ils parlèrent ainsi à Roboam :,0
Mais est-ce le souhait de tous ?,0
"Walpole accepte de retirer son projet avant que le Parlement n'ait voté, mais il écarte les politiciens qui ont osé s'opposer à lui.",1
"Toute difficulté respiratoire chez un animal est inquiétante, il s’agit généralement d’un problème cardiaque ou pulmonaire qui impose de consulter un vétérinaire dans un délai n’excédant pas une heure.",1
"Les mouvements célestes répondent donc à des lois mathématiques et déterminent des effets macroscopiques sur la Planète comme les saisons ou les rythmes de la nature, mais également des effets microscopiques comme tous les rythmes biologiques de ses différents règnes et créatures.",1
"L'inconvénient de Sanhok, c'est qu'il y a une course folle pour trouver un fusil dès le début, et sortir d'un bâtiment pour s'engouffrer dans un autre peut vous laisser sans défense si vous n'avez pas eu de chance au départ.Mais si vous passez la purge initiale, c'est une carte parfaitement conçue qui ressemble à une version condensée d'Erangel.",0
♪ Je dois peut-être te prévenir ♪,0
Le bilan énergétique,0
J'ai entendu dire que t'avais des...,0
Dans cette zone se trouvent les plus prestigieux vignobles de la Patagonie et bon nombre des bodégas dont les vins sont reconnus au niveau international.,1
"Dans us/où-est/Wayzata,minnesota vous trouverez plus d'informations sur Wayzata, MN, les distances des villes voisines et les grandes villes (en kilomètres et miles).",1
"Si tout va bien, il faut choisir cette option en ouvrant le fichier avec l'extension .JCSK pour la fois suivante.",1
Même résultat sans prendre de risques.,0
"Les symptômes d’une infection par listeria monocytogenes sont semblables à ceux d’autres maladies d’origine alimentaire montrant des signes de fièvre et de diarrhée, mais ils peuvent varier selon la personne.",1
Vous trouverez plus d'informations à ce sujet dans notre rubrique Au Pair.,1
Je ne suis pas si méchant que ça.,0
Cela en raison du fait que ces résultats sont tirés des données issues des rapports semestriels d'exécution que les responsables des opérations financées par le programme INTERREG IIIC ont présentés à la Commission européenne.,1
"Ainsi, vous pourrez à la fois éliminer les excès mais également garder votre corps tonique.",1
Il passe le projet pour la construction d'un terminal pour le charbon dans le port de Gladstone,1
"J'ai dû travailler très dur, très, très dur avec eux.",0
61% discount_off 1 nuitée en couple ou en famille près des chutes du Niagara (jusqu'à 82 % de rabais),0
- Quelle était la question ?,0
"Ces procédés, qui reposent sur un concept d’économie circulaire, sont susceptibles de créer un flux de valeurs ajoutées par la valorisation des lixiviats dont les produits dérivés pourraient alimenter plusieurs secteurs de l’économie « verte » québécois.",1
Ben Sherman T-shirts pour Hommes | A prix avantageux dans notre magasin outlet en ligne - dress-for-less,0
Nous remercions nos partenaires et commanditaires:,1
"Il en a fait assez pour ce soir, inspecteur.",1
"La surprise L'équipe a testé cette hypothèse sur des souris mâles et femelles, jeunes ou âgées.",1
"Ce qui prolonge la dernière poussée rapide vers la victoire, ce sont les négociations de dernière minute entre les militaires qui veulent s’orienter vers la Lumière et ceux qui désirent continuer à supporter la cause illicite de la cabale.",1
Ouvrez un compte gratuit maintenant!,0
Je gage que Smitty a 15 dollars sur lui.,0
Pourquoi tu cueilles toutes les pêches ?,0
- Il a beaucoup de choses à donner...,0
"Ne contient pas de cire et, afin, permet aux futures couches de vernis.",1
Dîner au restaurant de spécialités (à partir de 3 nuits),0
Daniel Haroldsen J'ai reçu le colis il y a quelques jours.Merci beaucoup !,1
"Ben, tu peux fouiller toute la maison pour trouver cette veste, mais j'essaie de protéger mon fils... s'il te plait n'appelle pas la police.",0
Ces tentatives constantes visant à modifier le décalogue et adapter par des altérations de la loi morale aux appétits développés par la vie lâche et facile constituent le péril remarquable à notre prospérité sans précédent ».,1
"La finale est relativement courte, légèrement austère et citrique, avec quelques notes maltées, florales, un peu d'eucalyptus et d'ananas.",1
Vous avez habité ailleurs.,0
Serez-vous le premier humain à gagner les faveurs d'un ogre ?,1
Il est à noter que l'onde ultrasonore a souvent la forme d'une impulsion brève comprenant plusieurs alternances.,1
"""» comme chien et chat - What rhymes with """"comme chien et chat""""?""",0
"Vous pouvez aussi envisager de participer à un programme d’entraide pour vous informer, apaiser vos inquiétudes et obtenir des réponses à vos questions et préoccupations.",1
Tresse [Instahair] Coiffures de fête : Misez sur les tresses pour briller,0
Non ! Il faut savoir parler à Google dans sa langue spécifique... ce que nos techniciens informatiques et développeurs web maîtrisent à merveille.,1
- Tu détruis mon éducation.,0
"T'es où, Phillip ?",0
Oh ce jeu en ligne libre de Tetris est l'un des jeux instantanés les plus provoquant une dépendance jamais !,0
1 Gratuit Essayer vos futures lunettes de chez vous !,0
"Pour chaque nouveau membre que tu recrutes, tu reçois CHF 50.- en remerciement de ton engagement pour un mouvement syndical fort.",1
Nous pouvons réduire les coûts et optimiser les chances.,1
Et ces rêves romantiques dans nos têtes,0
Donc c'est pour la drogue ?,0
Les normes de service constituent un engagement public de fournir un niveau de service mesurable auquel les clients peuvent s'attendre dans des conditions normales.,1
"Ce que Hitler n’avait pas réussi à accomplir, c’est le moral bombing qui le fit.",1
Qui est-ce qui râle le plus ?,0
"Si vous conduisez au travers des dunes, vous serez capables de vous trouver une plage déserte (c’est le cas de le dire 😉 !)",0
"En particulier, ce travail concerne le développement d’une méthode de guidage et de positionnement d’un drone à l’aide de capteurs lasers embarqués pointant sur des écrans placés autour de la zone dans laquelle le drone doit déposer les blocs de maçonnerie.",1
"Cela touche principalement les plus de 75 ans, de sorte qu'à l'âge de 85 ans, environ la moitié des Canadiens ont au moins une incapacité liée à la vision, à l'audition, à l'état cognitif, à la mobilité ou à la dextérité manuelle.",1
Tu as demandé à Wayne de mentir ?,1
Le contrat doit être signé par toutes les parties impliquées dans sa mise en œuvre.,1
"Ouais, je suis suspicieux, elle semble délicieuse.",1
"Les récits d’expérience sur l’Aide pour le commerce (OCDE/OMC, 2013) brossent aussi un tableau encourageant, en mettant en avant de multiples projets et programmes en lien avec le commerce qui, grâce au soutien des donateurs, produisent de nombreux impacts tangibles en termes de résultats commerciaux, d’investissement privé et de création d’emploi dans un grand nombre de pays en développement.",1
"Par example, on peut employer le rodage pour amincir la plaque de quelques centaines de μm.",1
Mais j’aimerais bien savoir ce qui se passe.,0
Vous pouvez demander un devis Ã Mustafa (le propriétaire) grâce au formulaire de contact.,1
- Pas de témoin ?,0
"Toutefois, la situation, telle qu'elle paraît se présenter, peut nous laisser perplexe.",1
"Procédé selon lʼune quelconque des revendications 9 à 11, comprenant en outre la sortie dʼun événement spécifié lorsquʼune demande dʼutilisation de ne pas hériter de lʼautorisation de partage ou dʼune autorisation de partage limitée est survenue.",1
Vous êtes-vous égaré en vous rendant à la gare?,0
Ils sont trop nombreux !,0
- Ne soyez pas trop regardant.,0
Il avait fait demi-tour.,0
"Si les codes le permettent et si on utilise un conducteur distinct de liaison à la terre, il est recommandé qu’un électricien qualifié vérifie la qualité de la liaison à la terre.",1
Rassemble tes sentiments.,1
Les Américains?,0
Aidez le petit homme trouver le bambin de nouvel an....,0
Ces peines visaient principalement à décourager la désertion durant une période où il y avait un manque important de main-d'œuvre.,1
Protéger la santé des athlètes et prévenir les maladies et les blessures dans le sport font partie des priorités absolues que se sont fixées le CIO et sa commission médicale et scientifique.,1
Mais il en signe aussi la traduction.,0
Catégorie Filles blondes baise Vidéos de sexe érotiques Vidéos porno première personne Les filles qui font des fellations filles aux gros seins baise Karmen Karma Keiran Lee Femmes mûres baise Les meilleures vidéos de parodie porno Marque Filles font du sexe chaud Filles avec de beaux seins baise Nymphomane Aventures sexuelles dans la vie quotidienne Chatte rasée Canapé tatouages Les femmes aux gros seins opérés,0
Monica : C’est vrai ?,0
Bah ouai en plus spa cher,0
Rocco Forte's Verdura Resort 4 nuits avec petit déjeuner et golf à partir d' € 579 à la basse saison,0
"Fantastique appartement, il est près de la ville de la nourriture et un centre de arpico, et les équipements sont tous prêts, je vais recommander à mes amis si elles viennent à l'expérience Colombo.Nice Victor2015-09-14T00:00:00Z",0
"C'est dans ce contexte que les ministres ont lancé le projet de recherche de Kobe, qui vise à faciliter les actions de recherche et les études menées dans le cadre de la coopération interrégionale sur des thèmes d'intérêt mutuel, tels que la coopération monétaire régionale, les régimes de taux de change dans le cadre de la coopération Asie‐Europe, etc.",1
"Du fait de l'intensification des négociations début mars, Jubilé Sud/Amérique a paru un communiqué de presse renouvelant sa solidarité avec ce mouvement de protestation en mettant en valeur que le FMI pousse le gouvernement à adopter des réformes afin de pouvoir rembourser la dette publique externe et interne, dette dont le caractère illégitime n'est plus à démontrer.",1
Ce coq Chantecler croyait que son chant faisait lever le soleil.,1
"Pour la montée des rapports, le passage du premier au deuxième mode se fait par le seul actionnement de l'embrayage 18, qui annule le glissement du convertisseur, et ramène le moteur à la moitié de sa vitesse maximale.",1
5: Maitencillo donne des meilleures vagues avec un peu de vent de mer).,0
Triple bain chambre triple avec douche,0
Que voir à Mount Ephraim et ses environs,0
"Votre Comité, qui a été autorisé par le Sénat à engager des dépenses aux fins d'examiner les mesures législatives et autres questions qui lui ont été déférées, dépose, conformément à l'article 104 du Règlement, le relevé suivant des dépenses encourues à cette fin par le comité au cours de la deuxième session de la trente-cinquième législature : Relatif à son étude des mesures législatives et l'étude spéciale sur le traitement réservé aux anciens combattants autochtones :",1
"50CH DVR, enregistrant 30 jours, avec des caméras 1.0MP 720p, espace de stockage sera:",0
Votre séjour à Hopetoun,0
"Dans l'affaireR 14/10, la Grande Chambre de recours a considéré que la CBE n'impose pas d'examiner une demande de brevet européen ou un brevet européen dans son intégralité, c'est-à-dire de procéder à un examen portant sur toutes les revendications en instance, si une revendication jugée non admissible est maintenue et qu'aucune requête subsidiaire concernant un jeu de revendications dépourvu de cette revendication non admissible n'est soumis.",1
Et pas un truc merdique.,0
"Le générateur no 1, le régulateur de carburant et la pompe à carburant entraînée par le moteur ont alors été remplacés.",1
- Il a lâché son boulot et il a pas pris sa paie...,0
"De performance égale, les deux broches de tournage peuvent être utilisées pour une coupe simultanée de deux pièces à la fois.",1
"1 Gratuit Jouer, le calendrier ou aléatoire notifications pour conduire vos amis fous!",0
Ou il vous emportera !,0
"Caisse de 5 rames (2 500 feuilles).Disponible Livraison en 1 ou 2 jours Votre prix 19,50 $",0
Elle est simple et nous suffit.,1
"C'est parti pour trois heures de spectacle (entrecoupées de pauses, de remises des prix...), avec des chansons, des saynètes, des tours de magie, de la danse, des concours...",0
"Quoi qu’il en soit, à la lumière des dispositions de la LRTFP et des arguments non contestés sur la communauté d’intérêts, je suis convaincu que l’unité proposée est habile à négocier collectivement.",1
Et elle est en train de donner naissance... et ne deviendra pas une mère.,0
"Non, non, laisse-le... laisse-le finir.",0
Outil pour corriger le son des fichiers MP4 mais pas de problème vidéo:,0
"Le concert de l'Orchestre Philharmonique de Wrocław s'inscrit dans le cadre du festival Soldaat _BAR_ Lamentatie, un projet musical de DeBijloke mis au point dans le but de commémorer le centenaire du début de la Première Guerre mondiale.",1
"On peut te protéger, te trouver un endroit où vivre, te trouver une orientation.",1
"Il s'agit d'analyser l'Énoncé des exigences pour établir une description initiale des objectifs du projet et des enjeux connexes, en donnant suffisamment de précisions pour permettre une évaluation préliminaire de la façon d'aborder le projet par rapport aux objectifs de SPAC (c.-à-d. sa nécessité, sa priorité et le niveau de ressources appropriées pour passer à la phase suivante).",1
Les épreuves de patinage de vitesse se disputent sur l'anneau olympique de Richmond.,1
Et ça me plaît.,0
Puis la pauvre Cheryl. Et Martin.,0
- Vous ne l'avez pas revue depuis ?,0
Je lui ai dit qu'il devait faire une croix sur toi.,1
"Aux premières heures de la journée de samedi, la plénière de clôture s’est vue présentée avec une décision de compromis résultant des consultations menées au niveau ministériel.",1
L’Espagne a reçu une demande de coopération judiciaire internationale de l’Italie après que le pays eut mené plusieurs enquêtes confirmant la falsification de produits pétroliers d’Andalousie.,1
"En réalité, c &apos; est exactement le contraire; la Chine n &apos; a demandé à personne de soumettre le projet de résolution.",1
Tu es assez stupide pour le laisser sortir par la porte?,0
"Qui c'est, Toby ?",0
Et Il est toujours le Tendre Seigneur Jésus.,0
"Annabeth, vous n'allez quand même pas laisser un jury décider, si ?",0
Hotels.com dispose actuellement de 7 hôtels à Hull disponibles à partir de 38 €/nuit seulement !,0
"Ils avaient le pressentiment que cette fête serait la dernière de la vie de leur Rav, Rabbi Israël.",1
"De par sa forme, un éclairage zénithal est recherché, il est orienté au Nord et permet d’optimiser le confort d’éclairement mais aussi d’assurer une meilleure gestion thermique du bâtiment.",1
"Néanmoins, celui-ci n’est pas au point. C’est la raison pour laquelle la Commission a proposé, en avril 2005, un ensemble de mesures visant à renforcer les capacités de réaction de l’Union européenne en matière de protection civile.",1
"En cas de décès, c’est le solde assuré de votre prêt qui est payé.",1
"– Ne manquez pas les sorties nature de Lulu, Guide nature de la station.",0
Soutenir le développement de l’enfant grâce à la collaboration et l’interaction numériques avec leurs parents.,1
"Sans préjudice de la possibilité, prévue par la législation communautaire, de déléguer certaines compétences et responsabilités prudentielles, la présence d'un coordinateur chargé de tâches spécifiques à la surveillance complémentaire des entreprises réglementées appartenant à un conglomérat financier ne modifie en rien la mission et les responsabilités incombant aux autorités investies d'une compétence par les règles sectorielles.",1
Votre dossier est présenté au Comité de crédit de la SOFINEX qui se réunit tous les mois.,1
Ce sont donc des hélicoptères à quatre rotors,0
"Nous avons donc ingénieusement conçu notre lobby pour que vous y sentiez non pas comme dans un lobby, mais comme dans un salon confortable, accueillant et chaleureux.",0
"Outre les données fournies par les corps policiers, nous examinerons également des données des cours criminelles provinciales recueillies par l’Enquête sur les tribunaux de juridiction criminelle pour adultes.",1
Des négociations qui ont d'ores et déjà commencé entre les différentes formations politiques sortira le nom du futur chef du gouvernement islandais.,1
"Je pense... je pense que peut-être on ne nous a donné que ça, des indices.",0
"Jake a ignoré son père, tout le temps qu'on était là.",0
"Dans un deuxième temps, seront clarifiés les éléments de la décision de 2001 qui ont été respectés.",1
"Puis, en 1965, la société Fisher Pen a déposé le brevet d'un stylo dont la cartouche était pressurisée avec du nitrogène.",1
Il adopta le nom de son père.,1
"Consignes à bagages Gare du Midi : 7 jours/7, à partir de 1 €/heure",0
Hotel Scandic Kajanus est idéal pour les familles avec de jeunes enfants.,1
Les terroristes djihadistes ne sont que des voyous avec des rêves de voyous.,0
"Il lance vers le fond du terrain, où un receveur s'est démarqué.",0
"À ce propos, des solutions et des adaptations ciblées sur différents niveaux ont été étudiées pour satisfaire chaque exigence spécifique, avec des interventions programmées, pour la maintenance ordinaire et extraordinaire des machines et des installations.",1
10 idées pour célébrer la Journée mondiale de la radio 2019 !,0
"Nel période janvier-Juillet de cet an le port a mouvementé dans l'ensemble 314.6 millions de tonnes, avec une croissance du 0,6% par rapport à 312.9 millions de tonnes dans le correspondant période du 2011.",1
"Dans cette petite et accueillante station alpine située en plein cœur du Parc National du Grand Paradis, l’air diffuse un parfum authentique de montagne, une montagne vivant au rythme de la nature.",1
"Il incombe à chaque partie de produire ses témoins à l'audience (à l'aide d'une assignation si nécessaire), de présenter tous les documents sur lesquels elle compte s'appuyer et de présenter sa cause.",1
Noix fraîches chinoises,0
Y a des gens qui voient les tentes et qui continuent leur chemin.,0
"Vous trouverez ci-dessous la liste des numéros d’identification de CPA pour les candidats ayant réussi à l’Examen final commun (EFC) des CPA lors la session du 12 au 14 septembre 2018, et ont accepté de faire publier leurs noms.",1
Qui peut tuer qui!,0
La fourniture pour les cabines de douche3,0
Célébration de la valeur de chaque personne – Nous connaissons et apprécions chaque personne ; nous nous écoutons les uns les autres et développons et partageons nos talents et nos dons.,1
Mais je suis sûr qu'il va réessayer.,0
"Plus de 1000 idées à propos de Dynamic Running Therapy sur Pinterest | Courir, Thérapie et Continuer",0
"1. Les pays dont la part indicative de réduction des émissions bénéficiant d’un soutien international est inférieure à 0,1% ne sont pas inclus dans cette liste.",1
Décrivez en quoi votre annonce est unique... Photos,0
"En plus, la Théorie de la Relativité est incompatible",1
Et avec succès !,0
"En effet, vous offrez ainsi sans relâche au Successeur de Pierre vos conseils éclairés fondés sur votre expérience pastorale de la situation de l'Eglise et de la société civile sur le continent africain.",1
Et qui revêts son cou d'une crinière flottante? Job 39:20 Le fais-tu bondir comme la sauterelle?,1
"DODO : Mais Steven, on a perdu.",0
Statistiques de vols pour Ballycorkey - Le saviez-vous ?,0
"Aujourd'hui, la réalité est autre.",0
Je veux en savoir plus,0
"Dès que vous y pensez, ça commence avec une démangeaison.",0
Ne fais pas ça.,0
"Dans le sud des États-Unis, le Râle jaune adulte est souvent attiré vers les rizières à proximité de l’habitat apparemment convenable; toutefois, l’espèce peut connaître un taux de mortalité élevé dans ces champs en raison des activités de récolte.",1
"Dans une déclaration signée par 13 institutions, organisations et personnalités de la Société Civile, les signataires se montrent préoccupés par la situation politique actuelle, qui place le pays selon eux « totalement en dehors de l’ordre républicain...",1
Ouvert toute l ́année @Sehr bel endroit juste sur la Regnitz.. Bonne connexion avec Bamber arrêt de bus juste sur le site. @ Ca.. à Bamberg 5 KM - accessible en vélo très rapidement..,0
1) numéro de suivi pour dépister votre paquet en ligne.,0
"Vous le lui dites, et vous partez.",0
Les la plupart de ils exigent d'un certain capital de commencer.Pas programmes de filiale !,0
"Les aspects du problème des OVNIS et les objectifs scientifiques les concernant sont, à mon avis, ceux-ci:",1
"Meilleures fonctionnalités, pour moins",0
Des milliers d'os furent déterrés ... Ils les sortaient et les jetaient quelque part dans les montagnes.,0
"Dans le menu à droite, vous trouverez les boutons avec lesquels vous pouvez ajouter un nouveau manuel au dispositif Philips SAC3540W, signaler un problème avec le manuel (par ex.",1
"Le deuxième propriétaire, (à partir de 2005 à aujourd'hui) a restauré toute la carrosserie de la voiture en bon état.",1
"Mais les deux marchandises dont la qualité égale, l'essence identique, est ainsi affirmée, n'y jouent pas le même rôle.",1
Notre objectif consiste à vous assurer le plus rapide accès au contenu de l'instruction d'utilisation du dispositif Kodak EASYSHARE CD93.,1
"Tentez votre chance aux tables de jeu de Las Vegas, Nevada.",1
Nous n'avions pas de quoi le retenir.,0
"Cela va beaucoup plus vite que nous nous attendions . Google sera prêt à libérer la version Chrome premier Android avec le lancement de Sandwich à la crème glacée semaine prochaine, nous dit-on .",1
N'ayez pas peur de demander de l'aide?Jour 24 :,0
Tu veux rencontrer notre équipe ?,0
Ce qui est le nom de domaine Bénin ?,1
"En 2008, Walker a amélioré encore plus son modèle de silencieux Quiet-Flow grâce à la puissance de l’acier inoxydable.",1
Meule à grain,0
« Dakhbit » est considéré comme un toponyme tadjik dans une région habitée par des populations ouzbek et tadjik.,1
"Il pourrait s’enfuir s’il le voulait: le vieillard accablé de douleur, épuisé par la lutte intérieure de ces trois journées terribles, ne pourrait s’opposer au vigoureux jeune homme.",1
"Sur cette assurance de son président, le Comité se sépara, après avoir remis au lendemain soir sa troisième séance.",1
Le mois le plus chaud de l'année est celui de Juillet avec une température moyenne de 33.5 °C. 19.6 °C font du mois de Janvier le plus froid de l'année. Tableau climatique Sweihan,1
Guérir... seulement avec l'écoute - voici la musique de Sat Hari Singh et Hari Bhajan Kaur sur leur troisième album.,0
"Un meilleur avenir pour ses enfants, pour lui-même.",0
"Ne ne pas avoir à télécharger une application à partir de la place du marché ou un APK, vous pouvez jouer directe, rapide, gratuit et sûr :-) Amusez-vous avec Turbo Truck!",0
"J’y porte plus avant les topiques structurelles de mon questionnement, celles des équivalences, des ressemblances, et de l’impuissance du langage à décrire le monde. La prose du monde (fecondation)",1
Vous êtes un gangster vous aussi tout comme Zoran Brasha.,1
"- David Lynch, cinéaste et président de la Fondation David Lynch pour la paix mondiale et une éducation fondée sur la conscience.",1
Vous partez en vacances pour Tabasco ?,0
