text,label
Shawn. Il faut que je te dise quelque chose avant que tu sortes !,0
"cette Hermes Birkin 35cm d'autruche Veines Sacs à main 6089 argent noir est livré avec: Hermes serrure, clés, clochette, traverses, livret de soins, protection contre la pluie, les étiquettes et copie du reçu original d'une boutique officielle Hermès.",0
LE TIRE-LAINE (faisant avec ses doigts le geste de subtiliser):,0
C'est terrible. Je suis désolée.,0
"La mesure a été mise en œuvre en mars 2014.5.2.12 La mission a examiné les dossiers du personnel et des postes pour s'assurer qu'ils sont complets, bien tenus et conservés de façon adéquate.",1
"""""""Vouloir combattre la religion au nom de l’objectivité, de la science, de la raison, est une entreprise vouée à l’échec. On ne peut pas plus supprimer le sentiment religieux qu’on ne peut supprimer les autres sentiments.""",1
"Encadrement : École de voile, école de tennis, école d'équitation Attraits et détente : Bar/pub, discothèque, restaurant, cinéma, cinéma d'été, karaoké, parc et jardin, parc de loisirs, réserve naturelle, centre d'exposition, galerie d'art, site historique, musée, théâtre, théâtre d'été, festival, antiquité & brocante, boutique d'artisanat, cave et dégustation de vin, bains naturels, thermes, centre de remise en forme, centre de beauté, centre de fitness",0
Bienvenue à notre nouveau lieu!,0
Je ne porterai pas un pull au gâteau!,0
- Je n'ai pas demande.,0
Les travaux sur les mouvements de l'ARN ont déjà été exposés dans la revue Nature.,1
"L’avis de conformité est une étiquette apposée sur une embarcation pour indiquer qu’elle répond aux Normes de construction des petits bateaux. Elle peut comprendre des renseignements importants sur la construction, par exemple la capacité maximale de l’embarcation.",1
Prévisions météo pour Stanhope cette semaine,0
Beaucoup de sourires.,0
"Et si son corps le produisait, par la peau ou dans des glandes ?",0
Classez les critiques par pays,0
Les prières montrent le profond amour et l'ardent désir pour Dieu. Chaque stance de la prière est en elle-même complète et entière.,1
"Et bien, vous avez choisi un très mauvais moment",1
Duna Beach: Vous pouvez organiser une réception informelle et décontractée pouvant accueillir jusqu'à 150 invités sur la plage. Cette zone à côté de la piscine peut être réservée à titre exclusif après 18h30 (sauf entre le 15 juillet et le 31 août).,1
-Tu es prêt ?,0
Titre: Le processus d'intégration est-il arrivé au terminus?,0
"Asperges landaises, Poulet basquaise, bœuf de Chalosse, Axoa de veau, magret, confit ou foie gras de canard.... Venez gouter ! Sans compter les desserts comme les tourtières landaises, les gâteaux basques ou les kiwis de l’Adour",0
C'est ce que j'ai dit au téléphone.,0
- C'est cela oui.,0
La lettre contenait aussi une proposition tendant à étudier les moyens d'améliorer le mécanisme de coopération et de consultation en vue de restaurer le régime de contrôle renforcé.,1
Nous sommes venus ici pour une raison.,0
"Voir, le cul de cette façon tout le monde était couvert.",0
Il vous a fait des propositions?,0
"59:19 Et, du couchant, ils craindront le nom de l'Éternel, et du lever du soleil, sa gloire. Quand l'ennemi viendra comme un fleuve, l'Esprit de l'Éternel lèvera un étendard contre lui.",1
Une maladie?,0
- Je ne te prête plus d'argent.,0
"Encouragez les enfants et les adolescents à assister à des réunions de groupes d'entraide, et assurez-vous qu'ils soient inclus dans les sessions de conseils.",1
- La psy est venue voir ce garçon ?,0
"Oui, car je te croyais assez intelligent pour attendre que je t'en donne l'ordre.",0
Que le tournoi commence!,0
Ce rapport vous est respectueusement soumis par les membres du Conseil d’administration et du personnel de l’OCVF :,1
Tu ne fais pas de moi un accident de train.,0
- de mères célèbres qui travaillent.,0
Les moyens les plus prometteurs d'aider les sociétés à prospérer sont souvent ignorés.,1
"Et je garderai un prix avec moi, jusqu'à ce que tu partes",0
La section B de l'annexe 703.2 porte sur les échanges commerciaux entre le Canada et le Mexique.,1
C'était pas vous.,0
"""Question classique ! Il y a de fortes chances pour que vous n'ayez sélectionné qu'une seule catégorie à l'affichage et que vous ne vous en souvenez plus ! Rien n'est perdu : tous les événements """"cachés"""" font partie de catégories qui ne sont pas affichées. Sélectionnez Catégorie dans le menu """"OPTIONS"""" puis cliquez sur """"TOUTES"""" dans le menu déroulant. Tous vos rendez-vous vont maintenant réapparaître comme par enchantement !""",1
"D'une texture plus douce, Paviplay Classic offre une protection optimale pour les tout-petits et les jeunes enfants contre les chutes et les bosses.",1
Le poker est dur,0
Des journées au parc ?,0
"WIPO GREEN est une base de données et un réseau en ligne permettant de rassembler un grand nombre d’acteurs de la chaîne de valorisation des innovations dans le domaine des technologies vertes et de mettre les détenteurs de nouvelles technologies en relation avec des entreprises ou des particuliers désireux de commercialiser, concéder sous licence ou distribuer des technologies vertes, ou encore d’avoir accès à ces dernières.",1
Qui diable est Julie ?,0
Même ton propre pays te veux mort !,0
"Cette coopération a donné lieu à l'élaboration d'une stratégie de services aux aînés qui s'inscrit dans le cadre de la Vision du service pour les Canadiens, et qui aidera le Ministère à améliorer les services aux aînés à l'échelle du gouvernement.",1
"Le revêtement en vinyle risque de fondre en cas de contact avec des casseroles, des poêles ou des ustensiles très chauds",1
Noah était venu sur l'île faire des recherches pour son livre.,0
"(e) Le payeur a la possibilité de demander à son prestataire de services de paiement de bloquer n'importe quel prélèvement sur son compte ou de bloquer n'importe quel prélèvement demandé par un ou plusieurs bénéficiaires spécifiés, ou de n'autoriser que les prélèvements demandés par un ou plusieurs bénéficiaires spécifiés.",1
Enfermé 23 heures par jour.,0
Souscrire aux flux RSS de la liste des commentaires,0
L’interrogatoire et l’examen clinique ont ici une importance majeure pour arriver au diagnostic.,1
"""""""Passe moi la salade"""" ?""",0
"Entre parenthèses, il a déjà été longuement soigné en Hongrie dans le passé.",1
Je suis prêt a aller en enfer,0
Conditions L’accès est possible 2 heures avant le départ programmé. - Les enfants de moins de 2 ans sont admis gratuitement.,0
- Je comprends.,0
"Moi, eux, vous, moi.",0
Arrepentida Artistes Isabel Pantoja Palos Copla Qui a acheté ces produits a aussi acheté Musique flamenco.,1
"Selon la théorie chinoise, le Yin est la force passive de l'univers, et le Yang, l'active.",1
"- présenter un amendement oral à l'amendement 130 qui n'a pas été retenu, plus de 40 députés s'étant opposés à sa prise en considération;",1
"Les bateaux sont différents, le record est plus dur à prendre aussi.",0
"Tiout regroupe 2 communautés : les amazighs à l’intérieur du ksar, et les arabes aux alentours du ksar.",1
Encore une autre année du retentissement pour LUI,0
"Mentions légales Limitations territoriales Le site, toutes ses pages et le matériel qu'ils contiennent ne s'adressent pas aux personnes appartenant à des juridictions dans lesquelles – en raison de la nationalité, de la personne, de sa résidence ou pour d'autres raisons – leur accès, leur consultation, disponibilité ou consultation ou publication sont limitées ou interdites.",1
Événements Concerts et Spectacles,0
Elle a changé. Elle est devenue possessive.,0
Je joue des shakers.,1
Et vous recevrez le Saint-Esprit.,0
Je mange plus de gluten !,0
"Dans la figure 11, un organigramme du sous-programme de traitement dʼinterruption lorsquʼun court-circuit est détecté est représenté également.",1
"Montréal 22 février 2018 – C’est avec beaucoup d’enthousiasme que la nouvelle plateforme événementielle TRIBUTE, dédiée exclusivement à faire rayonner les spiritueux et autres produits artisanaux d’ici, souhaite annoncer son association avec la Société des Arts Technologiques (SAT) dans le cadre de La Nuit Blanche à Montréal!",1
"En remplissant le module de contact avec leurs données, l’utilisateur accepte leur utilisation pour répondre aux demandes d’informations, de devis ou de tout autre type indiqué par l’en-tête du module. Données personnelles collectées: email.",1
Résumé : L’objectif principal de cette thèse est de tirer de données LiDAR de télédétection à très haute résolution afin d’extraire une partie du traces tectono-géomorphiques imprimées dans la morphologie de grands tremblements de terre préhistoriques.,1
"Vous acceptez de ne pas publier de contenu abusif, obscène, vulgaire, diffamatoire, choquant, menaçant, à caractère sexuel ou tout autre contenu qui peut transgresser les lois de votre pays, du pays où « forum du Poule Soie Club de France » est hébergé ou les lois internationales.",1
Vous séjournerez à 500 mètres d'une rue piétonne avec des bars et des restaurants ainsi qu'à 300 mètres du centre commercial Mammut.,1
Le périphérique n'est pas détecté,1
"Matériau en coton doux, gardez votre chiot plus mignon",0
Questions et réponses Obtenez des réponses rapides du personnel et des anciens clients de Bay View Guest House.,1
"Bien que plusieurs trouvent beaucoup moins compliqué de commander simplement un take-away, si vous voulez que votre corps à répondre favorablement à la médication consommer droite est la première chose que vous avez à faire.",1
"Néanmoins, il serait difficile d'expliquer pourquoi un État ayant objecté à une réserve à l'égard de l'État prédécesseur devrait réitérer son objection lorsque cette même réserve est reprise par l'État successeur.",1
- Tu ne portes pas les affaires de l'hôpital.,0
"Ce que j’ai instauré doit se poursuivre, c’est-à-dire le secrétariat travaillant de manière consultative avec la présidence, de manière collective et responsable.",1
"Je discutais au sujet de de la littérature avec Tatiana Poppel, une amie russe qui habitait là, et je lui parlais de mon roman préféré, Cien años de soledad, écrit par Gabriel Garcia Marquez.",1
Consultez le prix de notre parking couvert.,1
"On est proches, très proches.",0
"Ce que les adultes expriment à travers leur propre style vestimentaire ou une habitude particulière, les enfants le font de manière très informelle à travers le jeu.",1
"N’hésitez pas à oser les superpositions : ouverte comme un long manteau léger, sur un jean Straight ou un pantalon plus habillé mais toujours confortable Lila, combiné avec un tee-shirt débardeur Petra dessous, et le tour est joué !",1
"GENÈVE (ots) - S'ils veulent gagner, les sportifs d'élite et les amateurs doivent faire de leur santé bucco-dentaire une priorité absolue.",1
"Gestion, photos et image effets ont été tous très novateur et aussi brillant.",1
Voulez-vous des conseils détaillés?,0
"— Oui, je vous le jure!",0
"43. rappelle que la liberté d'expression et le pluralisme des médias, y compris sur l'internet, constituent des valeurs européennes fondamentales; insiste sur l'importance fondamentale de la liberté de la presse et des médias ainsi que des libertés numériques dans le contexte de la politique d'élargissement de l'Union, puisque ces libertés relèvent des droits de l'homme et sont par conséquent considérées comme partie intégrante des critères politiques de Copenhague;",1
Cette dernière doit agir en conformité avec la loi et ne peut traiter que des cas relevant du droit civil.,1
"Parce que tu n'as personne disant que tu étais président de l'union d'Oxford alors que c'était l'union de Cambridge, le plus grand club de débats dans l'histoire du Royaume-Uni.",0
Ce n'est pas du sang.,0
"Moins d'une semaine, huh?",0
"Lors de notre étude de 1994, ce bureau offrait un service satisfaisant en français.",1
"Pour cela il faut que notre production soit recyclable dès le départ, ou sinon d'empreinte écologique suffisamment faible pour être acceptée par les écosystèmes.",1
On a une description du van.,0
"Concours, concours et promotions . Si vous choisissez de participer à l'un de nos concours ou à d'autres promotions, nous pouvons divulguer vos informations à des tiers ou au public dans le cadre de l'administration de cette promotion, comme requis par la loi, conformément au règlement officiel de la promotion ou de toute autre manière. conformément aux termes de la présente politique de confidentialité.",1
Voici une sélection des meilleures offres de dernière minute pour les vols à destination de Tunis...,0
"Bonjour Les Gars, Vous pouvez vous confronter à votre...",0
"Introduction et des conseils sur la façon d'utiliser le manuel Xantrex Technology RS2000 - Au début de chaque manuel, nous devrions trouver des indices sur la façon d'utiliser le document.",1
"Il va avoir besoin de bien plus que ça, pour passer à travers.",0
Dominance War ne sera pas responsable en cas de participation manquante ou en retard pour quelque raison que ce soit. Il est de la responsabilité unique des participants de tenir compte des temps de mise en ligne et de s'organiser en conséquence.,1
Un an et presque trois mois.,0
"Il ne prend pas la réalité telle qu’elle. Il la reconstruit, dans un processus où tout interfère, y compris ses paramètres personnels : ses besoins, ses désirs du moment, mais aussi son histoire, ses expériences, ses valeurs, ses croyances.",1
"Une fois le tiroir-caisse ouvert, placez l'argent comptant ou le bon d'achat dans le tiroir et prenez la somme nécessaire pour rendre la monnaie.",1
Tout d'abord - le fichier QDA peut être lié (associé) d'une manière incorrecte à une application installée pour son service.,1
Tu vas bien ?,0
"Et pour tout vous dire, je partage son avis.",0
"12 Nous invitons ces gens-là, et nous les exhortons par le Seigneur Jésus Christ, à manger leur propre pain, en travaillant paisiblement.",1
C ́est très urgent mais vous pouvez encore apporter votre aide.,1
"Donc, c'est une grande science.",0
Le sénateur Graham et moi savons pourquoi leur offre a été rejetée.,0
Le film suivant de Kubrick allait s'avérer encore plus controversé.,1
"Le Comité a décidé d'inscrire le Complexe de conservation du Pantanal sur la Liste du patrimoine mondial sur la base des critères (ii), (iii) et (iv).",1
CA 6636/N est disponible dans 7 styles différents,1
"L'observation contextuelle consiste à observer les comportements des utilisateurs directement sur leurs lieux d'activité – au travail, dans leur salon, dans une boutique – ou dans une situation de mobilité – transports en commun, dans la rue.",1
"Si tu n'es pas content, prends ta part et décampe.",0
- T'as trouvé des médocs contre l'asthme ?,0
Voici un coup d’oeil au classement.,0
"Nous remercions notre partenaire: NOAA A la station „Wiesenburg“, pour août, les données comprises entre les années 1999 et 2005 ont été retenues pour le calcul de la moyenne.",1
"On a néanmoins utilisé les coliformes totaux comme substitut d'E. coli, principalement parce qu'il n'y avait pas de méthodes systématiques permettant de distinguer E. coli des autres coliformes.",1
"Le mois dernier des personnes qui étaient dehors tard la nuit ont rapporté avoir vu un aéronef, mais peu en croient les histoires.",1
"Selon nos données, Ryanair, Wizz Air et Blue Air sont les compagnies aériennes les moins chères sur ce trajet.",1
À quelle heure sont le premier et le dernier train Paris-Gare-de-Lyon - Montpellier St-Roch ?,1
"Ce programme vise à faire en sorte que l'équipement, les gares et les autres immobilisations de VIA Rail soient maintenus en bon état de fonctionnement, à améliorer la sécurité, l'accessibilité et le service aux passagers, en se concentrant particulièrement sur le corridor Québec-Windsor, d'où proviennent une bonne partie des usagers de VIA Rail.",1
Elle fera ce qu'il demande sans poser de questions.,0
"En tant que partisans de la transparence, nous énumérerons tous les points positifs et négatifs de chaque casino.",1
"Ce type d'investissements est une très bonne nouvelle au vu de la situation que connaît actuellement le secteur de la céramique en Espagne, et nous voudrions profiter de ces quelques lignes pour les remercier de la confiance qu'ils nous accordent.",1
Il ne sait pas.,1
Il y a une conférence à Grandview.,0
- T'as eu ça où ? - Pourquoi ?,0
La surface de l'eau est une des données les plus importantes pour un bassin qui doit bien fonctionner biologiquement car c'est là que se fait l'échange de gaz entre l'eau et l'air. (c'est une couche membrane pour l'échange oxygène/CO2).,1
"A propos, j'ai quelque chose qui pourrait vous donner du beaume au coeur:",0
"Si vous laissez votre laissez-passer de contrôle de sécurité expirer, vous devrez remplir un nouveau formulaire de demande de CIZR.",1
"Comme avec un marché haussier, un marché baissier peut affecter certains secteurs ou de la majorité d'un marché boursier.",1
Choisissez votre activité Développement personnel ci-dessous parmi 4 suggestions à moins de 200 miles de CBD Singapore .,1
"Bien relié à seulement 9 stations de métro de l'aéroport et à 5 minutes du centre-ville de Barcelone en voiture, bus, métro (ligne directe).",0
Qui ? On l'ignore.,0
Des guérisseurs !,0
"Il peut être rapide, facile, libre et en plus à essayer.",1
"Telles seront les banlieues de leurs villes. 6 Parmi les villes que vous donnerez aux Lévites, il y aura six villes de refuge où pourra s'enfuir le meurtrier, et quarante-deux autres villes.",1
Vous devez ensuite appeler la fonction fclose().,1
"Ross : Hé euh, eh bien, aujourd’hui c’est ma première conférence et j’aimerais la tester sur vous, les gars. Ça vous, ça vous dérange?",0
"Aujourd'hui, le produit de cette construction apparaît à la fois incontournable et fragile.",1
"Foré le lieu du festival local qui est.. e VA par l'intermédiaire, décision de rappel.",0
"Clen peut faire partie de l’équation, un gadget utile à vos demandes de combustion des graisses; il est néanmoins pas la réaction tout seul.",1
Ce sera plus sûr et permettra aussi d'économiser du carburant.,0
L’action de la gravité aux hautes températures transforme certaines puissances de circuits en énergies rayonnantes.,1
90 days of work now...Millionaire Tomorrow $$$ carte cacher cette annonce rétablir rétablir cette annonce,0
%30 bonus de dépôt et 25 tours gratuits sur la Sakura Fortune machine à sous vidéo à la Maison de Jack de casino,0
"Fans d’adrénaline et amateurs de good vibes, mettez ça à votre agenda, et suivez-nous pour en apprendre plus sur la programmation!",0
"Karl, s'il vous plaît !",0
Levez les boucliers déflecteurs.,0
"A cette époque, notre délégation parlementaire ne bénéficiait encore que du statut d’observateur, mais chaque fois qu’elle revenait de Strasbourg, elle ne manquait pas d’en rapporter des idées nouvelles propres à faciliter notre retour dans la famille des nations démocratiques d’Europe.",1
- C'est évident.,0
"Si vous n’avez pas résolu votre problème avec Pyle PT798SBA, avec l'aide du manuel que vous avez trouvé, posez une question en utilisant le formulaire ci-dessous.",1
50 millions d'euros pour l'extension du parc scientifique de Helsinki.,1
"C'est toujours mort, ici, les veilles de revue.",0
"Toutefois, l’Institut inclut les sociétés minières à titre de partie prenante essentielle dans son processus d’engagement.",1
Une délicieuse recette pour un invité.,1
"Je veux dire, avoir de la pornographie sur votre PC c’est des années 2000, je ne suis pas sûr de savoir qui le fait encore... peut-être l'ancienne génération ou certaine merde.",0
"Avec des objectifs allant de l'éradication de la faim à la fourniture à tous de l'électricité en passant par la protection des biosphères terrestre et aquatique ainsi que la lutte contre les changements climatiques, ce large éventail d'objectifs, parallèlement aux 169 cibles et 228 indicateurs qui les définissent, présente un ambitieux programme pour le changement entre 2016 et 2030.",1
"Un dispositif de ce gâteau sûr, sol bienà l'abri de l'humidité et le gel, mais en même temps et est coûteux.",1
"Du soutien à la littératie et à la numératie de base au soutien financier et aux expériences professionnelles offertes aux étudiants, en passant par la formation en métiers spécialisés, le gouvernement offre aux étudiants une vaste gamme de programmes de compétences pour répondre aux divers besoins.",1
"Mais cette histoire entre vous et moi, ce n'est pas un article que je peux écrire.",0
"""Des expériences réalisées avec un tel système d'isolation 7 montrent que, du fait de l'épaisseur sur la couche en feuille métallique extérieure 3, qui, dans le test, était constituée de 40 μm d'aluminium pur, celui-ci satisfaisait à l'exigence stipulée dans la réglementation suédoise de protection ignifuge """"couche superficielle de classe 1"""" selon SS 02 48 23/NORDTEST-FIRE 004.""",1
"Prie le Rapporteur spécial sur la situation des droits de l'homme au Myanmar de suivre l'application de la présente résolution, notamment en demandant à se rendre d'urgence dans le pays, et de faire rapport au Conseil des droits de l'homme à la reprise de sa sixième session et, à ce sujet, engage instamment le Gouvernement du Myanmar à coopérer avec le Rapporteur spécial;",1
Vous songez à construire votre propre système d’affiliation ?,0
"Cet exemple décrit un procédé de réalisation pratique, en trois étapes, d'un ensemble collecteur-électrode destiné à un générateur à électrolyte polymère également représenté de façon très générale à la FIGURE 1.",1
"""Et ça devait être votre grand, weekend """"on se remet ensemble"""" ?""",0
Ou peut-être le début parfait pour votre soirée!!,0
"Les éléments clés de masque public de Bush ou persona, correspondent à la communauté-service orienté bien-pensant Dink Stover, un ajout au début aux mille points de lumière.",1
"‘Nous avons besoin de l’engagement fort de toutes les Régions afin d’améliorer le partage des avantages et le fonctionnement du Système Multilatéral du Traité pour l’échange de la diversité des cultures’, a déclaré M. Matthew Worrell, Président de la Sixième Session de l’Organe directeur du Traité.",1
"Consultez votre transaction financière donc où et quand vous voulez, en utilisant votre téléphone portable.",1
"Veste matelassée pour homme, fermée par une fermeture éclair. Tissu de haute qualité. La capuche protège du vent et de la pluie. Deux poches extérieures verticales, cachées dans les coutures latérales de la veste. Disponible en version couleur noire. La veste fait partie de la ligne Dakar Diverse Extreme Team.",1
Tu dois continuer.,0
- Le bus est bloqué.,0
La durée de la période d'études standard dépend de votre discipline et de l'université.,1
Prévisions météo pour Oakleigh cette semaine,0
"""Ce financement est ce qui a permis au mouvement écologiste d'accéder à l'énorme pouvoir politique qu'il détient. """"""",1
Je connais quelqu'un.,0
"Si vous allez faire usage de la location de voiture Bentley Turba, Estonie, alors vous devez etre un vrai connaisseur de bonnes voitures, qui combinent harmonieusement la qualite et le design, la vitesse et le confort, la puissance et la beaute.",1
"L’APCE avait alors été poussée par une opinion européenne choquée par les bombardements sur Grozny qui avaient déjà fait plusieurs milliers de morts, et dont les télévisions disaient chaque jour qu’ils « s’intensifiaient ». [...]",1
Ajoutez à cela des balades en calèche et de l'initiation à l'attelage...,0
"Très spacieux et lumineux... comprend deux salles, deux cuisines.",0
"705.92 Hache de secours Une hache de secours est installée dans le poste de pilotage, sur la cloison située derrière le siège du pilote. 84.8.AC.10; art. 7 O",1
Des ressources à votre mesure - points saillants du nouveau programme de cours,0
"Le bungalow lui-même est simple et confortable avec tout ce dont nous avions besoin (pots et des casseroles, des jouets de plage, etc.",0
:: La santé et les substances toxicomanogènes chez les jeunes;,0
"Il ya 1 semaine 06:04 JizzBunker voyeur, maman salope, caché, bureau, douche",0
Elle t'écoute car elle t'admire.,0
"NetworkCare propose une gamme complète d'ententes de niveaux de service à nos clients qui comprennent les services de surveillance, de gestion et de soutien à valeur ajoutée dont ils ont besoin pour leurs réseaux convergés, voix et données. Nous mandat consiste à assurer le rendement des systèmes.",1
"Sur la gauche du symbole, une paire de chiffres indique le flux d'air en position de fonctionnement. ACTIONNEMENT ET RETOUR EN POSITION DE REPOS Le mode d'actionnement et le type de retour en position de repos est identifié par un symbole spécial, comme le montre la figure ci-dessous.",1
Avez-vous une question à propos de ViewSonic V35?,1
". (EN) J'ai voté en faveur du rapport Markov, car je pense que ce rapport a raison de louer le rôle de la Banque européenne pour la reconstruction et le développement pour l'aide qu'elle apporte aux PME dans les anciens pays communistes de l'Europe centrale et orientale.",1
